id,title,publisher,scrape_date,category,url
4701ac64-c854-4f4f-a871-9872ab151247,Trump directs ICE to increase actions in large Democrat cities,UPI,6/18/2025,policy,https://www.upi.com/Top_News/US/2025/06/16/Trump-ICE-New-York-Chicago-Los-Angeles/4911750072053/
01f0e8cc-e254-4de2-bc32-3babd10a6efc,"ICE is using no-bid contracts, boosting big firms, to get more detention beds",Hartford Courant,6/18/2025,detention,https://www.courant.com/2025/06/16/us-immigration-new-detention-centers/
91473300-2339-46c9-aec6-0a7becdad391,"ICE is using no-bid contracts, boosting big firms, to get more detention beds",Seattle Times,6/18/2025,detention,https://www.seattletimes.com/nation-world/nation/ice-is-using-no-bid-contracts-boosting-big-firms-to-get-more-detention-beds/?utm_source=RSS&utm_medium=Referral&utm_campaign=RSS_all
dd9a5558-7ad0-4a78-a5a7-82eb1d12191e,Trump administration considers major travel ban expansion: Live Updates,Newsweek,6/18/2025,policy,https://www.newsweek.com/donald-trump-administration-us-politics-live-updates-2085988
768ead17-c75d-4d21-a5aa-b88265f8f1e9,"Takeaways from AP’s reporting on shuttered prisons, mass deportation push and no-bid contracts",Seattle Times,6/18/2025,detention,https://www.seattletimes.com/business/takeaways-from-aps-reporting-on-shuttered-prisons-mass-deportation-push-and-no-bid-contracts/?utm_source=RSS&utm_medium=Referral&utm_campaign=RSS_all
35d6be3d-96a8-48c1-937b-4d64905e1587,Daywatch: Two detained on Father’s Day at Broadview immigration center,Chicago Tribune,6/18/2025,detention,https://www.chicagotribune.com/2025/06/16/daywatch-two-detained-on-fathers-day-at-broadview-immigration-center/
f9e1b40e-73f8-4df5-ab84-591278bf4bc6,Elon Musk may be gone but DOGE isn't done remaking the federal government,NPR,6/18/2025,other,https://www.npr.org/2025/06/16/nx-s1-5431926/doge-future-elon-musk
e64500be-591c-409a-91c5-3f8ada6da4e0,Journalists dodge rubber bullets in covering L.A. immigration protests,NPR,6/18/2025,protest,https://www.npr.org/2025/06/16/nx-s1-5434279/lapd-immigration-protests-journalists-rubber-bullets
71dcb183-2005-4b7c-b662-4cadbdf36560,"After early reprieve from immigration enforcement, farming industry reckons with raids",NPR,6/18/2025,raid,https://www.npr.org/2025/06/16/nx-s1-5430846/farming-industry-immigration-ice-worksite-enforcement-trump
30339088-7db4-4e11-8971-f108acffde91,A Closer Look At Uranus's Moons Reveals a Surprising Dark Side,Gizmodo,6/18/2025,other,https://gizmodo.com/a-closer-look-at-uranuss-moons-reveals-a-surprising-dark-side-2000615729
1c44b4d8-6a49-431d-bf3d-b317d1637310,CT immigrant community living in fear under Trump deportation plan: ‘People are taken every day in Connecticut’,Courant,6/18/2025,arrest,https://www.courant.com/2025/06/16/ct-immigrant-community-living-in-fear-under-trump-deportation-plan-people-are-taken-every-day-in-connecticut/
08318110-3e5b-492b-ad1a-5d248cf3b996,"President Donald Trump directs ICE to expand deportations in Democratic-run cities, including Chicago",Chicago Tribune,6/18/2025,policy,https://www.chicagotribune.com/2025/06/16/trump-ice-deportations-democratic-run-cities/
df295953-56b7-4f9b-93f6-68b5cac7b840,"Poll: Americans overwhelmingly want Trump to obey court rulings, but MAGA Republicans are split",NBC News,6/18/2025,opinion,https://www.nbcnews.com/politics/supreme-court/poll-americans-overwhelmingly-want-trump-obey-court-rulings-maga-repub-rcna212783
14b2851c-c8d4-400f-b403-5711c34bf32a,Immigration Raids Continue in California,Political Wire,6/18/2025,raid,https://politicalwire.com/2025/06/16/immigration-raids-continue-in-california/
84c5d3fa-b95c-4733-ae11-b202c732e6f9,Letters: Why not pose a ballot question to Illinois voters about sanctuary state status?,Chicago Tribune,6/18/2025,opinion,https://www.chicagotribune.com/2025/06/16/letters-061625/
31f9b49b-f86d-4faf-b0d7-cb3206a6b365,"5 things to know for June 16: Minnesota shootings, Israel-Iran, Russia-Ukraine, G7, Vaccines",CNN,6/18/2025,other,https://www.cnn.com/2025/06/16/us/5-things-to-know-for-june-16-minnesota-shootings-israel-iran-russia-ukraine-g7-vaccines
d8ec0f57-836e-4dd5-82dc-f5b28caa7ff3,Here’s what protesters say brought them out to ‘No Kings’ events across the country,CNN,6/18/2025,protest,https://www.cnn.com/2025/06/16/us/protestors-voices-no-kings-trump
6712164f-9bfb-4112-8dd4-b3a67c472d53,'We held our ground: CA health clinic describes close encounter with Trump's agents,Alternet,6/18/2025,arrest,https://www.alternet.org/trump-agents-los-angeles/
b27e2875-56b3-46f2-9d0f-1b354740b653,The Definitive Story of Tesla Takedown,Wired,6/18/2025,other,https://www.wired.com/story/tesla-takedown-definitive-story/
054396bd-0454-4bde-9cf9-517eadf1d401,The Online Tools That Fueled ‘No Kings’ and the Trump Resistance,Wired,6/18/2025,protest,https://www.wired.com/story/technology-tools-donald-trump-resistance/
342d9f34-dcc9-424e-a846-11c57addc4c5,6 Tools for Tracking the Trump Administration’s Attacks on Civil Liberties,Wired,6/18/2025,policy,https://www.wired.com/story/toll-trump-administration-policies-civil-rights/
fd0aa4ae-7b99-4a2f-9aa3-81754fb493e3,The Supreme Court decision that gives Trump cover for national ICE raids,Newsweek,6/18/2025,policy,https://www.newsweek.com/trump-administration-supreme-court-decision-immigration-enforcement-powers-2085281
6d82af7d-7c61-4b6d-bf25-aef38312c975,Illegal immigration a target for Ohio lawmakers,Dispatch,6/18/2025,policy,https://www.dispatch.com/story/news/politics/2025/06/16/illegal-immigration-a-target-for-ohio-lawmakers/84134201007/
ea610b25-6fdd-4bb9-9efe-a6de6307a5d8,Trump Launches Sweeping Immigration Crackdown On Democratic Strongholds,ibtimes,6/18/2025,policy,https://www.ibtimes.com/trump-launches-sweeping-immigration-crackdown-democratic-strongholds-3775775
ab70c354-5492-4fc5-b0db-db7460d22aae,Justice Department tells prosecutors to prioritize cases stemming from immigration unrest,cbsnews,6/18/2025,policy,https://www.cbsnews.com/newyork/news/justice-department-prosecutors-immigration/
0cc10d80-8b7d-446c-8091-2a5581dc81fb,AP Top Political News at 4:10 a.m. EDT,inquirer,6/18/2025,other,https://www.inquirer.com/wires/ap/ap-top-political-news-352-am-edt-20250616.html
3a413a65-6b6c-4d35-b4e1-5f7f7a36d877,Obama Calls For Dignity In Immigration Enforcement As ICE Crackdown Escalates,benzinga,6/18/2025,policy,https://www.benzinga.com/news/politics/25/06/45943372/obama-calls-for-dignity-in-immigration-enforcement-as-ice-crackdown-escalates
b7e8717a-2d53-4703-9c0e-cf078eb3e0ce,Justice Department tells prosecutors to prioritize cases stemming from immigration unrest,cbsnews,6/18/2025,policy,https://www.cbsnews.com/texas/news/justice-department-prosecutors-immigration/
3a0ac65f-210b-4f07-975b-2aea0ae70c6f,Donald Trump tells ICE agents to target Democratic strongholds,newsweek,6/18/2025,policy,https://www.newsweek.com/donald-trump-tells-ice-agents-target-democrat-strongholds-2085878
8ef84d1c-25c0-499f-83c4-38914ca2938f,Trump directs ICE to expand deportation efforts in America's largest cities,foxnews,6/18/2025,policy,https://www.foxnews.com/politics/trump-directs-ice-to-expand-deportation-efforts-in-americas-largest-cities
0c200398-0d9c-49d1-96dc-d633340498ee,Suspected Minnesota lawmaker assassin Vance Boelter captured,foxnews,6/18/2025,arrest,https://www.foxnews.com/us/suspected-minnesota-lawmaker-assassin-vance-boelter-captured
bd1278ab-64ae-4ac9-a1b5-4830745ebc49,Los Angeles Curfew To Continue For 'Couple More Days': Mayor,ibtimes,6/18/2025,other,https://www.ibtimes.com/los-angeles-curfew-continue-couple-more-days-mayor-3775771
f32fc7b4-1832-4350-baa0-592c44ce8ee6,"Trump directs ICE to expand deportations in Democratic-run cities, undeterred by protests",abcnews,6/18/2025,policy,https://abcnews.go.com/US/wireStory/trump-directs-ice-expand-deportations-democratic-run-cities-122879624
738c1a6b-3ece-40ba-b215-a8210a21bbf1,"New: Trump Orders Expanded ICE Raids in Los Angeles, Chicago, NYC",redstate,6/18/2025,raid,https://redstate.com/jenvanlaar/2025/06/15/new-trump-orders-expanded-ice-raids-in-los-angeles-chicago-nyc-n2190529
2e4d80d1-3d7f-4b90-989d-1f9b457aa230,AP Top Political News at 2:17 a.m. EDT,inquirer,6/18/2025,other,https://www.inquirer.com/wires/ap/ap-top-political-news-107-am-edt-20250616.html
b5be99bd-72d0-4ac8-a2be-0f8d9a96dac6,"Trump directs ICE to expand deportations in Democratic-run cities, undeterred by protests",ajc,6/18/2025,policy,https://www.ajc.com/news/2025/06/trump-directs-ice-to-expand-deportations-in-democratic-run-cities-undeterred-by-protests/
a2dd3865-7a8a-4ce9-9d1d-cb83e1eeecdd,"Trump directs ICE to expand deportations in Democratic-run cities, undeterred by protests",inquirer,6/18/2025,policy,https://www.inquirer.com/politics/nation/trump-directs-ice-expand-deportations-democratic-run-cities-20250615.html
6b8c84b0-64f5-4c4d-9fda-2de8145e51bd,VIDEO: Singer Performs National Anthem at Dodgers Game in Spanish as a Protest Against ICE,breitbart,6/18/2025,protest,https://www.breitbart.com/sports/2025/06/15/video-singer-performs-national-anthem-at-dodgers-game-in-spanish-as-a-protest-against-ice/
ad38f640-6af0-4e8b-a957-7622c73630bd,"Trump directs ICE to expand deportations in Democratic-run cities, undeterred by protests",sandiegouniontribune,6/18/2025,policy,https://www.sandiegouniontribune.com/2025/06/15/trump-deportations-ice/
e394ede7-13a9-4b34-beef-d90ec95f9e7b,"Nezza defies Dodgers, sings U.S. anthem in Spanish at game",staradvertiser,6/18/2025,protest,https://www.staradvertiser.com/2025/06/15/sports/sports-breaking/nezza-defies-dodgers-sings-u-s-anthem-in-spanish-at-game/
8b35d697-dc90-4050-a55a-403ddac5328d,John Oliver Slams Trump Over Response to Protests Against Immigration Raids: “He Is Such a Dick”,hollywoodreporter,6/18/2025,opinion,https://www.hollywoodreporter.com/tv/tv-news/last-week-tonight-recap-john-oliver-trump-immigration-raids-protests-1236291559/
b6e64b9c-b43b-4ff4-9d6b-28194735e2d0,"Trump directs ICE to expand deportations in Democratic-run cities, undeterred by protests",pilotonline,6/18/2025,policy,https://www.pilotonline.com/2025/06/15/trump-deportations-ice/
f7a6c313-a5f7-44bb-883f-19470385e7cf,Skewed Reporting From Los Angeles,spectator,6/18/2025,opinion,https://spectator.org/skewed-reporting-from-los-angeles/
674a9edb-d3d5-4cf0-b46c-160c4599c61b,Trump Orders Deportation Drive Targeting Democratic Cities,ibtimes.com,6/18/2025,policy,https://www.ibtimes.com/trump-orders-deportation-drive-targeting-democratic-cities-3775761
a9105721-5a4a-48bd-ac8b-a15e72cc83f3,Trump to flood big cities like LA and NYC with ICE agents in ‘single largest Mass Deportation Program’ in history,nypost.com,6/18/2025,raid,https://nypost.com/2025/06/15/us-news/trump-to-flood-big-cities-like-la-and-nyc-with-ice-agents-in-single-largest-mass-deportation-program-in-history/
0d3d86f2-d4e3-44fc-b5ec-4c1cc9d8fa56,San Francisco protesters block entrance to unmarked building amid fears of ICE trap,cbsnews.com,6/18/2025,protest,https://www.cbsnews.com/sanfrancisco/news/san-francisco-protesters-block-entrance-unmarked-building/
934cbd8d-6c8f-4026-a13f-1075b461878b,Donald Trump ordena expandir deportaciones en ciudades dirigidas por demócratas,elnuevodia.com,6/18/2025,policy,https://www.elnuevodia.com/noticias/estados-unidos/notas/donald-trump-ordena-expandir-deportaciones-en-ciudades-dirigidas-por-democratas/
8a33c481-1887-4bf1-a6e6-97a3d21b9098,"Trump directs ICE to expand deportations in Democratic-run cities, undeterred by protests",seattletimes.com,6/18/2025,policy,https://www.seattletimes.com/nation-world/nation/trump-directs-ice-to-expand-deportations-in-democratic-run-cities-undeterred-by-protests/?utm_source=RSS&utm_medium=Referral&utm_campaign=RSS_all
02be9f00-3d2a-4751-ac9d-9c1a9c4ca1ab,Inside Trump’s extraordinary turnaround on immigration raids,bostonglobe.com,6/18/2025,raid,https://www.bostonglobe.com/2025/06/15/nation/inside-trumps-extraordinary-turnaround-immigration-raids/
3214e8d9-ee65-4d5b-8368-eb471bdff268,You Won't Believe LA Mayor Karen Bass' Father's Day Message,townhall.com,6/18/2025,other,https://townhall.com//tipsheet/saraharnold/2025/06/15/you-wont-believe-mayor-bass-fathers-day-message-n2658838
422529b0-ba36-42b5-afda-63960b4bf437,Surprise: The Portland Riots Got Violent,townhall.com,6/18/2025,protest,https://townhall.com//tipsheet/saraharnold/2025/06/15/portland-rioters-got-violent-n2658828
8554e59d-17b5-4118-88a0-99933a79d641,Utah 'No Kings' Protest Erupts in Shooting As Rioters Chant '86 47',townhall.com,6/18/2025,protest,https://townhall.com//tipsheet/mattvespa/2025/06/15/utah-no-kings-shooting-n2658833
59688f15-d1a3-4bb0-93bf-5cd83dd886c6,Trump Orders ICE to Double Down on Deportations in Dem-Run Cities,townhall.com,6/18/2025,policy,https://townhall.com//tipsheet/saraharnold/2025/06/15/trump-orders-ice-to-double-down-on-deportations-in-dem-run-cities-n2658847
fb5805b0-f51c-40a8-897a-14df23922362,"Trump directs ICE to expand deportations in Democratic-run cities, undeterred by protests",ocregister.com,6/18/2025,policy,https://www.ocregister.com/2025/06/15/trump-deportations-ice/
04f2a1ff-0b23-4452-88eb-af706bce190d,"Trump directs ICE to expand deportations in Democratic-run cities, undeterred by protests",baltimoresun.com,6/18/2025,policy,https://www.baltimoresun.com/2025/06/15/trump-deportations-ice/
91adcffd-55cc-4257-9078-9ff4b856dd0d,'We're not intimidated': Minnesota AG Ellison reacts to death of 'dear friend' state Rep. Hortman,msnbc.com,6/18/2025,other,https://www.msnbc.com/politicsnation/watch/-we-re-not-intimidated-minnesota-ag-ellison-reacts-to-death-of-dear-friend-state-rep-hortman-241633861503
13dd612c-173e-4553-a2ac-5505ed2b95f2,Nationwide warrant issued for suspect in Minnesota lawmaker shootings,msnbc.com,6/18/2025,arrest,https://www.msnbc.com/msnbc/watch/nationwide-warrant-issued-for-suspect-in-minnesota-lawmaker-shootings-241630277886
ddabe36d-cf2c-47ea-93b8-a5518190b8f6,Trump Policies Underwater: New NBC poll shows 60% disapprove his handling of tariffs and trade,msnbc.com,6/18/2025,policy,https://www.msnbc.com/the-weekend/watch/trump-policies-underwater-new-nbc-poll-shows-60-disapprove-his-handling-of-tariffs-and-trade-241619013946
998aaa90-61f6-42bd-9534-d4cbf4cf5966,Trump using military against citizens is ‘no longer theoretical’ says Bloomberg Opinion editor,msnbc.com,6/18/2025,opinion,https://www.msnbc.com/weekends-with-alex-witt/watch/trump-using-military-against-citizens-is-no-longer-theoretical-says-bloomberg-opinion-editor-241626181797
b8f74393-f269-4f31-a418-17badb5bac5f,Resistance or bust: Military troops in U.S. cities signal a national inflection point,msnbc.com,6/18/2025,protest,https://www.msnbc.com/ali-velshi/watch/resistance-or-bust-military-troops-in-u-s-cities-signal-a-national-inflection-point-241625669639
d4f95c0a-645f-43f7-af6d-1a4ef5a76a2f,Car and hat of suspect in Minnesota shootings found,msnbc.com,6/18/2025,arrest,https://www.msnbc.com/weekends-with-alex-witt/watch/car-and-hat-of-suspect-in-minnesota-shootings-found-241623109870
d9abf01b-fc33-4bde-8e66-2432052e373b,Dem. Rep. warns against escalating political violence & calls for unity to address heated rhetoric,msnbc.com,6/18/2025,opinion,https://www.msnbc.com/weekends-with-alex-witt/watch/dem-rep-warns-against-escalating-political-violence-calls-for-unity-to-address-heated-rhetoric-241627717526
b8ba1a0a-01d5-4bcd-a86b-a5c5f1f3ae1c,"2025 FIFA Club World Cup: Vision, Competition, And Controversy",forbes.com,6/18/2025,other,https://www.forbes.com/sites/marklasota/2025/06/15/2025-fifa-club-world-cup-vision-competition-and-controversy/
9fd6f2a4-cc4a-4a04-9007-0672afcb8f26,"NBA legend Doc Rivers joins ""The Best People with Nicolle Wallace""",msnbc,6/18/2025,other,https://www.msnbc.com/msnbc/watch/nba-legend-doc-rivers-joins-the-best-people-with-nicolle-wallace-241628741555
45e6954e-306d-4282-b2f0-fd90dfa9342e,‘Dangerous for democracy’: Marine Vet Rep. Moulton slams Trump’s military deployment to protests,msnbc,6/18/2025,protest,https://www.msnbc.com/the-weekend/watch/-dangerous-for-democracy-marine-vet-rep-moulton-slams-trump-s-military-deployment-to-protests-241620037870
e1cf48e2-3431-49cb-b0da-8d7804a7cc8b,Ret. U.S. Army General: [military parades] ‘are what dictators do’,msnbc,6/18/2025,opinion,https://www.msnbc.com/the-weekend/watch/ret-u-s-army-general-military-parades-are-what-dictators-do-241620037604
0260ecb7-3a3b-4b9f-a01b-5d4e347cb7a8,L.A. Mayor describes 'atmosphere of fear' amid Trump's ICE raids,msnbc,6/18/2025,raid,https://www.msnbc.com/politicsnation/watch/l-a-mayor-bass-describes-atmosphere-of-fear-amid-trump-s-ice-raids-241631301830
55fcc581-e861-4c19-bcf7-dc6063e0ba0c,Trump rejected Israeli proposal to assassinate Iranian supreme leader: U.S. officials,msnbc,6/18/2025,policy,https://www.msnbc.com/weekends-with-alex-witt/watch/trump-rejected-israeli-proposal-to-assassinate-iranian-supreme-leader-241626181514
6c0f48d4-2b5a-4ec0-8dd0-1f14004e02e4,"New poll shows Trump’s approval numbers begin to lag on economy, immigration",msnbc,6/18/2025,policy,https://www.msnbc.com/weekends-with-alex-witt/watch/new-poll-shows-trump-s-approval-numbers-begin-to-lag-on-economy-immigration-241626693971
35f173db-c3cf-43c5-98ae-36b2aa79f5c3,Trump vetoed Israeli plan to assassinate Iran’s supreme leader,msnbc,6/18/2025,policy,https://www.msnbc.com/msnbc/watch/trump-vetoed-israeli-plan-to-assassinate-iran-s-supreme-leader-241625157948
1a2a8842-67b5-48e0-8fc2-048346081402,A decade of Donald Trump,msnbc,6/18/2025,other,https://www.msnbc.com/the-weekend-primetime/watch/a-decade-of-donald-trump-241633861800
89bd1a9e-6ba1-4c76-a9be-9cd7aa053508,Chicago Mayor vows to stand up to Trump as city braces for ICE raids,msnbc,6/18/2025,raid,https://www.msnbc.com/the-weekend/watch/chicago-mayor-vows-to-stand-up-to-trump-as-city-braces-for-ice-raids-241624133528
1fda93af-d03c-40c4-9be1-e3fbac9ed96a,Rep. Angie Craig calls for political rhetoric to turn down after killing of Minnesota lawmaker,msnbc,6/18/2025,protest,https://www.msnbc.com/weekends-with-alex-witt/watch/rep-angie-craig-calls-for-political-rhetoric-to-turn-down-after-killing-of-minnesota-lawmaker-241627717568
3874d30f-d8da-4a6e-a3a5-082df1f7a4ac,"'The rule of law is clearly under attack': Fmr. prosecutor on Trump admin., state of U.S.",msnbc,6/18/2025,opinion,https://www.msnbc.com/the-weekend-primetime/watch/-the-rule-of-law-is-clearly-under-attack-fmr-prosecutor-on-trump-admin-state-of-u-s-241632325967
75a17027-410c-4572-9b7f-70004cdca26f,Trump le ordena al ICE ampliar las deportaciones en ciudades gobernadas por demócratas,chicagotribune,6/18/2025,policy,https://www.chicagotribune.com/2025/06/15/trump-le-ordena-al-ice-ampliar-las-deportaciones-en-ciudades-gobernadas-por-demcratas/
ee0ab508-91e6-48cd-b8d1-eb8b627d22eb,'Simply outrageous': Napolitano on Trump federalizing the CA Natl Guard,msnbc,6/18/2025,opinion,https://www.msnbc.com/ali-velshi/watch/-simply-outrageous-napolitano-on-trump-federalizing-the-ca-natl-guard-241624645657
d765c079-a06c-45fa-9599-249dbf12f5e8,Mahmoud Khalil spent Father's Day weekend in ICE detention — away from newborn son,msnbc,6/18/2025,detention,https://www.msnbc.com/the-weekend-primetime/watch/mahmoud-khalil-spends-father-s-day-in-ice-detention-241631813831
d5e71438-de0b-48c7-80d7-d07b50a71a09,Former State Department official questions Trump’s stance on Israel-Iran after new detail revealed,msnbc,6/18/2025,policy,https://www.msnbc.com/weekends-with-alex-witt/watch/former-state-department-official-questions-trump-s-stance-on-israel-iran-after-new-detail-revealed-241627717520
7b560df7-ca5a-404a-8a3c-fce3998dc97c,Minnesota Rep included in targeted list decries political violence as she remembers slain lawmaker,msnbc,6/18/2025,protest,https://www.msnbc.com/the-weekend/watch/minnesota-rep-included-in-targeted-list-decries-political-violence-as-she-remembers-slain-lawmaker-241619525990
13b05aec-d2b6-4082-bdd7-9dedcdd9d192,Scientists warn Trump cuts to NIH funding could cost lives,msnbc,6/18/2025,policy,https://www.msnbc.com/ali-velshi/watch/scientists-warn-trump-cuts-to-nih-funding-could-cost-lives-241624645643
1912bd29-29d3-465f-bd34-701a2f219086,Rep. Kamlager-Dove praises peaceful protests and blasts ICE raids across Los Angeles,msnbc,6/18/2025,protest,https://www.msnbc.com/weekends-with-alex-witt/watch/rep-kamlager-dove-praises-peaceful-protests-and-blasts-ice-raids-across-los-angeles-241627717541
944cba31-0b94-45eb-89cb-dac9bfee9058,We have gone too far’ The Weekend hosts weigh in on the shootings of 2 MN lawmakers,msnbc,6/18/2025,protest,https://www.msnbc.com/the-weekend/watch/-we-have-gone-too-far-the-weekend-hosts-weigh-in-on-the-shootings-of-2-mn-lawmakers-241619013661
99696f51-5639-458c-ac45-b03a29c57d6c,'We’re in a bad place': Former NYC Mayor Bill de Blasio on the rise of political violence in America,msnbc,6/18/2025,protest,https://www.msnbc.com/the-weekend-primetime/watch/-we-re-in-a-bad-place-former-nyc-mayor-bill-de-blasio-on-the-rise-of-political-violence-in-america-241635397597
509e138d-e985-4bde-a70b-69ca88c00cd0,Roommate of Minnesota shootings suspect reads final text message from him,msnbc,6/18/2025,other,https://www.msnbc.com/msnbc/watch/roommate-of-minnesota-shootings-suspect-reads-final-text-message-from-him-241628741819
15f34c1e-0f1b-4350-a099-a6d3b34b5e92,DNC Vice Chair Malcom Kenyatta Responds to AFT President Randi Weingarten's Resignation,msnbc,6/18/2025,other,https://www.msnbc.com/the-weekend-primetime/watch/dnc-vice-chair-malcom-kenyatta-responds-to-aft-president-randi-weingarten-s-resignation-241633349742
086752e8-170a-49b6-9c96-0704dd28089d,This culture of violence is not sustainable: Rep. Hakeem Jeffries on Minnesota targeted attacks,msnbc,6/18/2025,opinion,https://www.msnbc.com/the-weekend/watch/this-culture-of-violence-is-not-sustainable-rep-hakeem-jeffries-on-minnesota-targeted-attacks-241619013880
59824029-7019-4dcc-a331-dfc81bc9415c,Former Marine says everyone deserves legal pathway to U.S. citizenship,msnbc,6/18/2025,opinion,https://www.msnbc.com/msnbc/watch/former-marine-says-everyone-deserves-legal-pathway-to-u-s-citizenship-241625157934
b00d15ac-d055-4577-ab04-801bc239a385,"About 10,000 people gather downtown for Dallas No Kings protest",Dallas News,6/18/2025,protest,https://www.dallasnews.com/news/politics/2025/06/14/live-no-kings-protests-north-texas-trump-june-14/
f847245c-3e83-4678-a19f-d9ec3fed4227,"Trump directs ICE to expand deportations in Democratic-run cities, undeterred by protests",Twin Cities,6/18/2025,policy,https://www.twincities.com/2025/06/15/trump-deportations-ice/
17178776-a4b1-4617-b9a5-086d7d5b2d03,"Trump directs ICE to expand deportations in Democratic-run cities, undeterred by protests",Orlando Sentinel,6/18/2025,policy,https://www.orlandosentinel.com/2025/06/15/trump-deportations-ice/
54f49f8b-94b4-4773-ad1d-0133a6f36f12,"Second migrant who escaped New Jersey ICE detention captured, two runaways still at large",New York Post,6/18/2025,detention,https://nypost.com/2025/06/15/us-news/two-of-four-migrants-who-escaped-nj-ice-detention-captured/
e07c96ec-1b3e-43eb-941c-b9964f76de23,"Meet the Press — June 15, 2025",NBC News,6/18/2025,other,https://www.nbcnews.com/meet-the-press/meet-press-june-15-2025-n1312278
05a2b4b0-7b11-4657-a32a-d67ebffcd904,"False ICE raid rumor spread by California city councilmember spoils popular flea market, hurts local vendors: ‘He scared a lot of Mexicans away’",New York Post,6/18/2025,raid,https://nypost.com/2025/06/15/us-news/false-ice-raid-rumor-spread-by-california-city-councilmember-spoils-popular-flea-market-hurts-local-vendors/
e3014a9f-64ca-4a52-8907-cbd3bcb4725d,"Trump directs ICE to expand deportations in Democratic-run cities, undeterred by protests",Sun Sentinel,6/18/2025,policy,https://www.sun-sentinel.com/2025/06/15/trump-deportations-ice/
2e8c5924-1a3e-464d-8247-44f1a376a4b9,"Karen Bass Blames Riots, Trump's 'Escalation' for Pulling Police from Palisades",Breitbart,6/18/2025,protest,https://www.breitbart.com/law-and-order/2025/06/15/karen-bass-blames-riots-trumps-escalation-for-pulling-police-from-palisades/
fbe50a3b-0dd9-4a22-a79f-2ef8ea7d606a,Nezza Says She Sang National Anthem in Spanish at Dodger Stadium Against Team's Request,Rolling Stone,6/18/2025,other,https://www.rollingstone.com/music/music-news/nezza-national-anthem-spanish-dodger-stadium-1235365155/
d8bd314d-8c27-4e8f-88ec-b47eaaef63d2,Singer Olivia Rodrigo 'deeply upset' at 'violent deportations' happening in Los Angeles,Fox News,6/18/2025,opinion,https://www.foxnews.com/media/singer-olivia-rodrigo-deeply-upset-violent-deportations-happening-los-angeles
bc4da78e-36d5-4271-ab13-b61d43e2d8a2,"Minnesota officials find car, hat belonging to assassin suspect Vance Boelter on highway in 'fluid' search",Fox News,6/18/2025,arrest,https://www.foxnews.com/us/minnesota-officials-find-car-hat-belonging-assassin-suspect-vance-boelter-highway-fluid-search
6261c39e-ee49-48a9-a335-2501fc573346,FBI confirms capture of 2 of 4 illegal immigrants who escaped from Newark ICE facility,Fox News,6/18/2025,detention,https://www.foxnews.com/us/fbi-confirms-capture-illegal-immigrants-who-escaped-newark-ice-facility
8a1dff78-e13b-4fc1-acde-88f25dec56ca,"Trump directs ICE to expand deportations in Democratic-run cities, undeterred by protests",Hartford Courant,6/18/2025,policy,https://www.courant.com/2025/06/15/trump-deportations-ice/
faff04be-664d-49dd-b089-b373d99c6414,EPA drops case against prison company that has donated heavily to Trump,Schwartz Report,6/18/2025,policy,https://www.schwartzreport.net/2025/06/15/epa-drops-case-against-prison-company-that-has-donated-heavily-to-trump/
