id,title,publisher,scrape_date,category,url
b3861ce4-9018-4556-beeb-9f42c6d65c96,How crucial is immigration for the US hotel industry?,reuters,6/18/2025,other,https://www.reuters.com/business/world-at-work/how-crucial-is-immigration-us-hotel-industry-2025-06-13/
8f428c5e-73f3-45cc-ba51-093c884cf145,Good and welcome trouble from California Sen. Alex Padilla,seattletimes,6/18/2025,opinion,https://www.seattletimes.com/opinion/good-and-welcome-trouble-from-california-sen-alex-padilla/?utm_source=RSS&utm_medium=Referral&utm_campaign=RSS_all
c3ad4a28-56af-4f9e-b812-744152adb369,Massachusetts judge blocks Trump’s election executive order. Follow live updates.,bostonglobe,6/18/2025,policy,https://www.bostonglobe.com/2025/06/13/nation/trump-presidency-live-updates/
81b97402-ab10-4a7c-add8-1f978cf2b7a5,"4 detainees have escaped from an immigration detention center in Newark, New Jersey, DHS says",courant,6/18/2025,detention,https://www.courant.com/2025/06/13/immigration-protests-new-jersey/
8ee49935-c0b0-48a7-ba7e-86003c0e78e3,"Americans will feel impact of immigration enforcement on farms, union president warns",npr,6/18/2025,raid,https://www.npr.org/2025/06/13/nx-s1-5431612/trump-ice-farm-raids-united-farm-workers-union
6e527bd8-8137-4785-96cd-3e9f9059c17b,Politicians Imitating Protestors Bad Omen for Democratic Party,spectator,6/18/2025,protest,https://spectator.org/politician-imitating-protestors-bad-omen-democrat/
b019314c-30ce-4ede-b154-cfa686ea93a8,‘I can’t take being locked up like this anymore.’ Detained immigrants at Burlington ICE facility allege unsafe conditions.,bostonglobe,6/18/2025,detention,https://www.bostonglobe.com/2025/06/13/metro/detained-immigrants-burlington-ice-conditions/
31e86a7d-6bf4-41a4-aeb9-82bc6f47efe2,Veterans Affairs Secretary Has a Message for Politicians Who Let Rioters Shut Down Clinics,dailysignal,6/18/2025,protest,https://www.dailysignal.com/2025/06/13/cabinet-member-confronts-newsom-for-prioritizing-anti-ice-rioters-over-veteran-care/
8b05f88e-9447-4f40-a233-57eb61838c4f,U.S. files suit against New York State over courthouse arrest law,upi,6/18/2025,arrest,https://www.upi.com/Top_News/US/2025/06/13/New-York-Protect-Courts-Act-Bondi-Hochul-James-arrest/2241749824329/
541d4a10-9944-411d-bbe0-3352bcf874d7,Man in custody for impersonating officer while carrying weapon during Chicago ICE protest,cbsnews,6/18/2025,protest,https://www.cbsnews.com/chicago/video/man-in-custody-for-impersonating-officer-while-carrying-weapon-during-chicago-ice-protest/
9a442bf6-110c-41fa-8396-6c1e94465649,"4 detainees have escaped from an immigration detention center in Newark, DHS says",bostonglobe,6/18/2025,detention,https://www.bostonglobe.com/2025/06/13/nation/newark-migrant-detention-center/
bcc9c667-bbc5-408e-b671-ca85ef22cc8f,"Four detainees escaped from Newark ICE facility, DHS says. Here's what's happening at Delaney Hall.",cbsnews,6/18/2025,detention,https://www.cbsnews.com/newyork/news/newark-ice-delaney-hall-escape/
d98ec633-fb41-4512-b9db-6b9d47ec85c2,Trump Wins Temporary Stay To Keep Control Of National Guard Ahead Of LA Protests,ibtimes,6/18/2025,protest,https://www.ibtimes.com/trump-wins-temporary-stay-keep-control-national-guard-ahead-la-protests-3775576
86a83ee0-4666-4ebb-8d5f-f72b34a903cc,"4 detainees have escaped from an immigration detention center in Newark, New Jersey, DHS says",baltimoresun,6/18/2025,detention,https://www.baltimoresun.com/2025/06/13/immigration-protests-new-jersey/
dabd019f-a5b9-468e-b08e-f1fff8036a29,"Cuatro personas escapan de centro de detención para migrantes en Newark, Nueva Jersey, según el DHS",chicagotribune,6/18/2025,detention,https://www.chicagotribune.com/2025/06/13/cuatro-personas-escapan-de-centro-de-detencin-para-migrantes-en-newark-nueva-jersey-segn-el-dhs/
5ca94637-1d6c-4eb2-a14c-db39f72f6495,Trump Lurches Us Toward a Police State,thenation,6/18/2025,opinion,https://www.thenation.com/article/politics/trump-padilla-police-state/
136e6257-9f05-40c3-9d32-bfca32cdd8f6,Todd Lyons Says What His ‘Biggest Fear’ Is About Planned Nationwide Left-Wing Protests,Daily Caller,6/18/2025,protest,https://dailycaller.com/2025/06/13/todd-lyons-biggest-fear-about-planned-nationwide-left-wing-protests/
dd494dfd-203f-4570-9667-cda1fa6f6146,Video Shows ICE Agents Letting Man Go After Neighbors Interrupt Raid,Daily Caller,6/18/2025,raid,https://dailycaller.com/2025/06/13/video-shows-ice-agents-letting-man-go-neighbors-interrupt-raid/
f2b958d7-3486-40ba-98de-65af887a3ebb,"4 detainees have escaped from an immigration detention center in Newark, New Jersey, DHS says",Pilot Online,6/18/2025,detention,https://www.pilotonline.com/2025/06/13/immigration-protests-new-jersey/
855a8fa0-f985-4ecd-b429-559d6e03d9ce,EXCLUSIVE: Anti-ICE Org Backing National Protests Led By Member Of CCP-Tied Group,Daily Caller,6/18/2025,protest,https://dailycaller.com/2025/06/13/exclusive-asian-americans-for-progressive-america-leader-united-chinese-americans-ccp/
47066c86-a6fe-4915-9fab-2a66581c14a3,Youngkin says authorities ‘prepared to keep the peace’ amid weekend’s ‘No Kings’ protests,Pilot Online,6/18/2025,protest,https://www.pilotonline.com/2025/06/13/youngkin-no-kings/
b0507396-a311-4ceb-b0ac-ef7e94bd747f,EXCLUSIVE: Dem Rep Takes ‘Fake’ Phone Call To Dodge Question About LA Riots,Daily Caller,6/18/2025,protest,https://dailycaller.com/2025/06/13/tom-suozzi-fake-phone-call-los-angeles-riots/
95fa6338-3527-442f-999b-9b063a84ec18,"4 detainees have escaped from an immigration detention center in Newark, New Jersey, DHS says",Twin Cities,6/18/2025,detention,https://www.twincities.com/2025/06/13/immigration-protests-new-jersey/
bc33f932-3954-4e64-8ca5-e48b3f003037,MAGA Freaks Out as Man Arrested for Allegedly Handing Out 'Bionic' Face Shields to Protesters,Gizmodo,6/18/2025,arrest,https://gizmodo.com/maga-freaks-out-as-man-arrested-for-allegedly-handing-out-bionic-face-shields-to-protesters-2000615038
d532457e-d241-4d2b-96a3-b9562b8a0f35,"4 detainees have escaped from an immigration detention center in Newark, New Jersey, DHS says",Orlando Sentinel,6/18/2025,detention,https://www.orlandosentinel.com/2025/06/13/immigration-protests-new-jersey/
2b6d6d89-16ae-4a97-b1bf-4398d77c0918,Protesters rally outside Angel Stadium against ICE sweeps in Anaheim,OC Register,6/18/2025,protest,https://www.ocregister.com/2025/06/13/photos-protesters-rally-outside-angel-stadium-against-ice-sweeps-in-anaheim/
9d2a1c32-3897-485f-908c-1777d438ed1f,"4 detainees have escaped from an immigration detention center in Newark, New Jersey, DHS says",OC Register,6/18/2025,detention,https://www.ocregister.com/2025/06/13/immigration-protests-new-jersey/
4f39b88f-d6d8-4d1a-ba50-89b7f9f1f1cf,How ICE Raids Have Impacted Texas Rapper HOODLUM’s Hometown,Pitchfork,6/18/2025,raid,https://pitchfork.com/thepitch/how-ice-raids-have-impacted-texas-rapper-hoodlum-hometown/
6884e81a-5e06-42f9-81e7-ad0d77b10045,"4 detainees have escaped from an immigration detention center in Newark, New Jersey, DHS says",Sun Sentinel,6/18/2025,detention,https://www.sun-sentinel.com/2025/06/13/immigration-protests-new-jersey/
2ddefd36-6ab3-4757-9c32-e31ee5e9a1ae,"Trump administration can deploy National Guard to Los Angeles for now, appeals court rules",CBS News,6/18/2025,policy,https://www.cbsnews.com/miami/news/trump-troop-deployment-los-angeles-judge/
60365284-0aa2-4736-b4be-3cfa673370a1,Stanley Cup Final is becoming a showcase for the Oilers' Leon Draisaitl,AJC,6/18/2025,other,https://www.ajc.com/news/2025/06/stanley-cup-final-is-becoming-a-showcase-for-the-oilers-leon-draisaitl/
6e2d13c8-23d4-49f1-bd22-e846d69e8535,Sign of the times: Seattle top cop’s prediction,Seattle Times,6/18/2025,opinion,https://www.seattletimes.com/opinion/sign-of-the-times-top-cops-prediction/?utm_source=RSS&utm_medium=Referral&utm_campaign=RSS_all
853e5457-6315-4b68-9bd9-d37fe200abd1,"4 detainees have escaped from an immigration detention center in Newark, New Jersey, DHS says",AJC,6/18/2025,detention,https://www.ajc.com/news/2025/06/4-detainees-have-escaped-from-an-immigration-detention-center-in-newark-new-jersey-dhs-says/
0dd0b53d-ba7b-457c-a562-55547bcd2da1,‘Only A Matter Of Time’: Todd Lyons Warns Dems’ Anti-ICE Rhetoric Will ‘Get Somebody Killed’,Daily Caller,6/18/2025,opinion,https://dailycaller.com/2025/06/13/todd-lyons-warns-dems-anti-ice-rhetoric-killed/
8d060329-ef8d-42e8-904d-ed2b6380fc07,Alexander: FIFA’s Club World Cup hasn’t captured our imagination,OC Register,6/18/2025,other,https://www.ocregister.com/2025/06/13/alexander-fifas-club-world-cup-hasnt-captured-our-imagination/
cf2a5a64-1425-4e21-9636-7edea7d959e9,Woman detained on honeymoon faces deportation despite being stateless,Newsweek,6/18/2025,detention,https://www.newsweek.com/stateless-woman-detained-honeymoon-faces-deportation-2085161
6c372fa6-9c0e-4095-8cc5-beaff177a3d4,"Trump administration can deploy National Guard to Los Angeles for now, appeals court rules",CBS News,6/18/2025,policy,https://www.cbsnews.com/texas/news/trump-troop-deployment-los-angeles-judge/
a6b45a37-46f3-4abb-8ed0-c0f094564005,Restaurant helping police in LA Riots flooded with positive reviews,Newsweek,6/18/2025,protest,https://www.newsweek.com/pupuseria-la-ceiba-la-riots-reviews-helps-2085205
1e905550-d9ec-4459-b235-f71bb6221ac9,Padilla stood up to tyranny,Baltimore Sun,6/18/2025,opinion,https://www.baltimoresun.com/2025/06/13/padilla-stood-up-to-tyranny/
bbc19b61-8c5b-425e-8acd-ce7df3a24d8e,"Four detainees at Newark immigration facility have escaped, DHS says",NBC News,6/18/2025,detention,https://www.nbcnews.com/news/us-news/four-detainees-newark-ice-facility-are-missing-senior-officials-say-rcna212893
45e979b9-d98f-4a10-bfd5-fb52c9189e4b,ICE protests live updates: Weekend of rallies planned nationwide; Trump and Newsom spar over National Guard,NBC News,6/18/2025,protest,https://www.nbcnews.com/news/us-news/live-blog/ice-protests-live-updates-weekend-rallies-planned-nationwide-rcna212809
003c42e3-ca9c-49b3-9a74-bbd82c5170a2,Hochul defends New York immigration policies against Republican attacks,Newsday,6/18/2025,policy,https://www.newsday.com/long-island/politics/hochul-immigration-t8dejmd3
dd4cef29-53e8-434a-b3bf-65c5b2c2b229,Westbury traffic stop of Latino man spurs calls for federal probe,Newsday,6/18/2025,arrest,https://www.newsday.com/long-island/homeland-security-latino-traffic-stop-westbury-federal-probe-g2ntv0uq
dbe7c879-ff02-4102-9fbe-0cd76bd0ad02,"Ex-congressman Billy Long confirmed as commissioner of the IRS, an agency he once sought to abolish",Newsday,6/18/2025,other,https://www.newsday.com/news/nation/billy-long-confirmed-irs-commissioner-u23322
836b1d67-9ab1-4061-8fe6-c577ac641642,Trump DOJ sues NY over immigration enforcement in state courts,USA Today,6/18/2025,policy,https://www.usatoday.com/story/news/nation/2025/06/12/trump-doj-lawsuit-new-york-immigration-courthouse/84175026007/
1806510d-c61b-498a-9350-70bbf92d6a0e,'Wave of panic': Trump immigration raids rattle businesses,USA Today,6/18/2025,raid,https://www.usatoday.com/story/money/2025/06/12/trump-immigration-crackdown-rattles-businesses/84175142007/
9406d7b8-1cc9-4aca-bc97-0b0702d3d6fa,Why ICE and Border Protection will be at FIFA Club World Cup games,USA Today,6/18/2025,other,https://www.usatoday.com/story/sports/soccer/2025/06/12/ice-border-protection-fifa-club-world-cup-gold-cup-security/84153876007/
fac1c3a8-b81d-484d-bedf-f9fa378d9008,Louisiana is the latest Republican-led state expanding its role in immigration enforcement,Newsday,6/18/2025,policy,https://www.newsday.com/news/nation/louisiana-immigration-bills-enforcement-crackdowns-d56897
b1811ae1-d0d3-439c-8d1b-5f8ac8a0af96,'I don't feel like a king' says Trump,USA Today,6/18/2025,other,https://www.usatoday.com/story/news/politics/2025/06/12/trump-not-king-president/84169145007/
ca302bab-cb30-44c1-b7ca-557a5f50110c,"4 detainees have escaped from an immigration detention center in Newark, New Jersey, DHS says",Newsday,6/18/2025,detention,https://www.newsday.com/news/nation/immigration-detention-center-newark-new-jersey-delaney-hall-l43108
5900ae30-84fa-4d08-ab24-574335abcf2a,"Hochul, other Democratic governors defend immigration policies before House panel",Syracuse.com,6/18/2025,policy,https://www.syracuse.com/politics/2025/06/hochul-other-democratic-governors-defend-immigration-policies-before-house-panel.html
2f319b5a-877d-4f56-bd81-0f2d82a7c163,"ICE protests: Americans split on Trump's use of military, poll finds",USA Today,6/18/2025,protest,https://www.usatoday.com/story/news/politics/2025/06/13/americans-split-military-ice-protests-reutersi-psos-poll/84181704007/
e3371d31-e751-425f-9f0a-3132ec4bd23d,"Nationwide protests against immigration raids escalate, leading to arrests and curfews",Newsday,6/18/2025,protest,https://www.newsday.com/news/nation/immigration-crackdown-us-protests-f36935
5297be33-a19d-4ac9-b9e6-1b0c5ea570a2,2025 Stanley Cup Final Proving That Sequels Can Be Better,Deadspin,6/18/2025,other,https://deadspin.com/2025-stanley-cup-final-proving-that-sequels-can-be-better/
4b694776-56d4-4e64-aa82-8235c41b4123,Returned Salvadoran migrant Kilmar Abrego Garcia arraigned on federal human trafficking charges in Tennessee,Fox News,6/18/2025,arrest,https://www.foxnews.com/politics/returned-salvadoran-migrant-kilmar-abrego-garcia-arraigned-federal-human-trafficking-charges-tennessee
817b5dbf-ef80-4d40-ba7c-e07ded261999,The High-Flying Escalation of CBP's Predator Drone Flights Over LA,Wired,6/18/2025,other,https://www.wired.com/story/cbp-predator-drone-flights-la-protests/
48e7f26d-9521-4872-adc1-58aecfc59f70,"Newsom tries to give Trump the Biden treatment, says he's 'not all there'",Fox News,6/18/2025,opinion,https://www.foxnews.com/media/newsom-tries-give-trump-biden-treatment-hes-not-all-there
f5f41172-d88d-4c9c-aab9-3d11d2f5f97c,"Border Patrol will be at the Club World Cup, says it's routine to provide security for such events",Newsday,6/18/2025,other,https://www.newsday.com/sports/soccer/club-world-cup-border-patrol-f53798
7b8f89f7-2bae-4969-bf48-eb40e6333204,TikTok star Khaby Lame plays soccer in Brazil after US detention,Newsday,6/18/2025,detention,https://www.newsday.com/news/nation/brazil-tiktok-khaby-lame-emerson-royal-n19150
7f23c5ac-46cd-4cc3-a323-eb66fc502061,LA protester charged with assaulting officer says he was the one attacked: ‘I thought I was going to die’,The Guardian,6/18/2025,protest,https://www.theguardian.com/us-news/2025/jun/13/protester-charged-ice-los-angeles
faff53de-d4f7-427d-88f8-da15c4a335b6,Trump visited Kennedy Center for 'Les Mis.' The irony.,USA Today,6/18/2025,opinion,https://www.usatoday.com/story/opinion/columnist/2025/06/13/trump-kennedy-center-les-mis-woke/84168339007/
c8f73285-3fbc-48d1-889c-0268926b92cf,Are Democrats Lurching Into a Winning Strategy on Deportations? Probably Not,HotAir,6/18/2025,opinion,https://hotair.com/david-strom/2025/06/13/are-democrats-lurching-into-a-winning-strategy-on-deportations-n3803734
b30daba8-0832-4bae-bbd9-18704867f573,No Kings protests will cast shadow over Trump's parade,USA Today,6/18/2025,opinion,https://www.usatoday.com/story/opinion/columnist/2025/06/13/military-parade-trump-no-kings-protests/84172997007/
7f0b2fdf-09b5-42ca-8a85-183bcfbfabec,Photos: Chicago’s ICE protests,Chicago Tribune,6/18/2025,protest,https://www.chicagotribune.com/2025/06/13/photos-chicagos-ice-protests/
4689772d-31db-45d6-9d3c-68e015801021,LA protests live: Trump maintains control of National Guard,USA Today,6/18/2025,protest,https://www.usatoday.com/story/news/nation/2025/06/13/ice-protests-immigration-news-live-updates/84176164007/
203b2441-878b-4068-a90d-d1ee98e1ab11,Anti-Trump ‘No Kings’ protest in Philly on Saturday will prompt road closures,The Philadelphia Inquirer,6/18/2025,protest,https://www.inquirer.com/news/philadelphia/no-kings-protest-philadelphia-road-closures-start-time-location-20250613.html
dd8e7005-cf3d-47a5-9ea8-2ea941ff5cf0,"As Marines arrive in Los Angeles, courts battle over executive power to deploy military",Christian Science Monitor,6/18/2025,policy,https://www.csmonitor.com/USA/Justice/2025/0613/los-angeles-military-trump?icid=rss
c284b5f4-2afa-465f-ac1e-a68b0dfe2d75,Army's $40 million parade: 'Once-in-lifetime opportunity',USA Today,6/18/2025,other,https://www.usatoday.com/story/news/politics/2025/06/12/army-parade-trump-birthday-once-lifetime-opportunity/84171517007/
01cc4f2f-52fc-4d8d-8686-8ec26cc110ac,How JB Pritzker’s faith and Holocaust work are powering his dire warnings about Trump,Christian Science Monitor,6/18/2025,opinion,https://www.csmonitor.com/USA/Politics/2025/0613/jb-pritzker-holocaust-antisemitism-trump?icid=rss
bb67d9e3-a829-4d68-8ab7-0f68fc1b5185,Trump is making life hell for immigrants in California—and everywhere else,Daily Kos,6/18/2025,opinion,https://www.dailykos.com/story/2025/6/13/2327617/-Trump-is-making-life-hell-for-immigrants-in-California-and-everywhere-else?pm_campaign=blog&pm_medium=rss&pm_source=
5251e321-d5b3-4065-8bd4-43c843758ef9,Jon Meacham Admits Country Awash In Political Violence — But Leaves Out Key Detail,Daily Caller,6/18/2025,opinion,https://dailycaller.com/2025/06/13/jon-meacham-admits-country-awash-in-political-violence-but-leaves-out-key-detail/
d9e47b01-f973-4ac6-ae5e-a8a60488326f,Did Senator ID himself when Kristi Noem's guards wrestled him?,Newsweek,6/18/2025,arrest,https://www.newsweek.com/did-senator-alex-padilla-id-himself-kristi-noem-guards-wrestled-2085009
9e9c2d0b-d214-45a3-afa1-1b04b3c39831,Porsha Williams’ Ex Simon Guobadia Breaks Silence After ICE Detention,US Magazine,6/18/2025,detention,https://www.usmagazine.com/celebrity-news/news/porsha-williams-ex-simon-guobadia-breaks-silence-after-ice-detention/
7c5de2d9-0693-4604-95eb-8a915dff746a,Disorder breaks out at New Jersey immigration detention center,The Philadelphia Inquirer,6/18/2025,detention,https://www.inquirer.com/news/new-jersey/delaney-hall-new-jersey-immigration-detention-center-protest-disorder-20250613.html
7d8999c1-3135-4784-beed-06a31035b716,Trump’s morally bankrupt mass deportation plan revels in cruelty and brutality,The Philadelphia Inquirer,6/18/2025,opinion,https://www.inquirer.com/opinion/editorials/trump-immigration-protests-human-rights-20250613.html
2aebda91-c32c-416e-8acc-239587f86052,"Trump admits crackdown hurts farmers/hospitality, says change coming",AZ Central,6/18/2025,policy,https://www.azcentral.com/story/news/politics/immigration/2025/06/13/trump-admits-immigration-crackdown-hurts-hospitality-farm-workers/84176114007/
8666f46b-46b8-4144-8332-1ed89ea1e2f9,Home Depot’s day laborer haven turns into immigration target across Southern California,ocregister,6/18/2025,raid,https://www.ocregister.com/2025/06/13/home-depot-a-longtime-destination-for-day-laborers-part-of-symbolic-southern-california-raids/
09fdcbd7-97a3-463b-b4a9-5777a9e0581d,"Gavin Newsom rediscovers that ""fighter"" is a good look",salon,6/18/2025,opinion,https://www.salon.com/2025/06/13/gavin-newsom-rediscovers-fighting-maga-is-popular/
c803b3d7-92da-42af-b277-7d8ce521a924,Trump’s ICE arrests non-criminals despite crime-focused message,reuters,6/18/2025,arrest,https://www.reuters.com/world/us/trumps-ice-arrests-non-criminals-despite-crime-focused-message-2025-06-13/
b6e7170b-55dd-4b61-8ffa-603fa43e32f7,Worse than Orbán: Trump is trying to bring his opposition to heel,salon,6/18/2025,opinion,https://www.salon.com/2025/06/13/worse-than-orbn-is-trying-to-bring-his-opposition-to-heel/
edbd08e7-d446-451d-a7f3-892efbf58407,Ivy League bio smuggling suspect with ties to American adversary gets break from federal judge,foxnews,6/18/2025,arrest,https://www.foxnews.com/us/ivy-league-bio-smuggling-suspect-ties-american-adversary-gets-break-federal-judge
b8be537c-2e8f-4ccb-af11-48b8061a49bd,Is Trump's Troop Deployment to Los Angeles Illegal?,rollingstone,6/18/2025,policy,https://www.rollingstone.com/politics/politics-features/trump-troop-deployment-los-angeles-is-it-legal-1235364017/
bcb913fe-b9d3-4a81-b85d-c92fe6318f05,Man Claims ICE Raided an Elementary School Graduation. It Was a Total Lie.,townhall,6/18/2025,raid,https://townhall.com//tipsheet/mattvespa/2025/06/13/man-claims-ice-raided-an-elementary-school-graduation-it-was-a-total-lie-n2658713
7883328e-c50f-47ec-a004-b1c64f79afcb,Illegal Aliens Escaped From a New Jersey ICE Detention Center,townhall,6/18/2025,detention,https://townhall.com//tipsheet/madelineleesman/2025/06/13/4-migrants-escaped-ice-detention-center-new-jersey-n2658734
9b4a8b25-ba38-4177-8bc3-c4462b474230,Sen. Alex Padilla’s crime? Being Mexican in MAGA America,latimes,6/18/2025,opinion,https://www.latimes.com/california/story/2025-06-13/sen-alex-padillas-crime-being-mexican-in-maga-america
301d47a1-21ca-49a5-8717-13f3848364d3,Federal troops will remain for now ahead of possible 7th day of protests,ocregister,6/18/2025,protest,https://www.ocregister.com/2025/06/13/federal-troops-will-remain-for-now-ahead-of-possible-7th-day-of-protests/
1f098a75-8912-4a6e-b453-22ce2def4dc5,"Graduation day at Maywood Academy High, where students are 98% Latino; 100% All-American",latimes,6/18/2025,other,https://www.latimes.com/california/story/2025-06-13/lausd-high-school-graduation-amid-ice-raid-fears
caa4f3a4-335a-4a0c-ab5e-01f36d1ba904,Trump allowed to keep National Guard in Los Angeles as more protests planned,reuters,6/18/2025,protest,https://www.reuters.com/world/us/trump-allowed-keep-national-guard-los-angeles-more-protests-planned-2025-06-13/
523e9dee-d6b8-492d-b820-8442475bc52b,Militarized riot approach sets nation on dangerous course,ocregister,6/18/2025,opinion,https://www.ocregister.com/2025/06/13/militarized-riot-approach-sets-nation-on-dangerous-course/
cc5b515e-c34a-410b-9b06-ada55a29f425,Disorder breaks out at New Jersey immigration detention center,seattletimes,6/18/2025,detention,https://www.seattletimes.com/nation-world/nation/disorder-breaks-out-at-new-jersey-immigration-detention-center/?utm_source=RSS&utm_medium=Referral&utm_campaign=RSS_all
7a363969-445a-48c8-bc6f-c39e303d5bbd,"TikTok Star Khaby Lame Detained by ICE Over Visa, Voluntarily Departs the United States",ibtimes,6/18/2025,detention,https://www.ibtimes.com/tiktok-star-khaby-lame-detained-ice-over-visa-voluntarily-departs-united-states-3775534
d6eb1157-8173-4c61-b52f-ce6401866bf5,'L.A. Was Not on Fire': Angelenos Speak on Trump's ICE Raids and 'Escalation',rollingstone,6/18/2025,protest,https://www.rollingstone.com/politics/politics-features/los-angeles-not-on-fire-trump-ice-protests-national-guard-1235363990/
89d50eca-c206-4c4e-bb67-74e55528deef,"For religious leaders and their flocks, deportation threats test faith",tampabay,6/18/2025,other,https://www.tampabay.com/news/2025/06/13/religious-leaders-their-flocks-deportation-threats-test-faith/
fb825c28-6451-4889-b25b-6b35f2eb3ef6,How Florida protest organizers are preparing as LA unrest unfolds,tampabay,6/18/2025,protest,https://www.tampabay.com/news/florida-politics/2025/06/13/immigration-protest-la-tampa-ice/
09d0e7a5-b078-4c14-bb1a-84768b8378e6,"‘The Stakes Are Real’: Border Hawks Counting On ‘Big, Beautiful Bill’ To Reach Finish Line",dailycaller,6/18/2025,policy,https://dailycaller.com/2025/06/13/border-hawks-back-big-beautiful-bill/
cae239a2-ec0b-4cf8-9368-7edaeeb24855,VICTOR DAVIS HANSON: The Rogue’s New Gallery Of Left-Wing Scoundrels,dailycaller,6/18/2025,opinion,https://dailycaller.com/2025/06/13/victor-davis-hanson-left-wing-scoundrels-ice-trump-derangement-syndrome-newsom/
ae41364a-a118-4bc4-8947-810ecc7ad0cf,"World’s top TikTok star, Khaby Lame, plays soccer in Brazil after ‘self-deporting’ from US",New York Post,6/18/2025,detention,https://nypost.com/2025/06/13/media/tiktok-star-khaby-lame-plays-soccer-in-brazil-after-us-detention/
0a65f2ce-59bc-41fd-a626-8496e5b7651f,Tennessee judge to hear arguments about releasing Kilmar Abrego Garcia from pretrial detention,Hartford Courant,6/18/2025,detention,https://www.courant.com/2025/06/13/abrego-garcia-pretrial-detention-hearing/
0f9c2602-699a-4183-a8ac-c1b2f8c2a049,Healthcare or Homeland Security? Ohio bill would force hospitals to welcome ICE agents,Cleveland.com,6/18/2025,policy,https://www.cleveland.com/news/2025/06/healthcare-or-homeland-security-ohio-bill-would-force-hospitals-to-welcome-ice-agents.html
10c6007e-739d-48a5-9619-85bf7caa5a2f,"Oilers rally, stun Panthers in overtime to tie series 2-2; big names struggle in first round of U.S. Open",CBS Sports,6/18/2025,other,https://www.cbssports.com/nhl/news/oilers-rally-stun-panthers-in-overtime-to-tie-series-2-2-big-names-struggle-in-first-round-of-u-s-open/
a7615d19-87f1-42bc-855b-4ecdf94fc074,LA Taco chain closes 15 locations amid ICE crackdown,Newsweek,6/18/2025,raid,https://www.newsweek.com/los-angeles-taco-chain-closed-ice-crackdown-2085076
d8ffd2b0-ac96-4acd-b3ed-01b0b0d43e5c,Texas' largest newspaper trashes Greg Abbott protest move: 'Expect better',Newsweek,6/18/2025,protest,https://www.newsweek.com/texas-largest-newspaper-trashes-greg-abbott-protest-move-expect-better-2085043
98f5e012-bc95-4e5f-b561-652acdc89dc3,‘No Kings’ Protests Coincide With Trump Army Parade Saturday—Organizers Expect Millions To Demonstrate,Forbes,6/18/2025,protest,https://www.forbes.com/sites/yezensaadah/2025/06/13/thousands-of-no-kings-protests-planned-against-trumps-policies-on-day-of-army-parade-what-to-know-about-saturday/
9e65639a-d3b9-448f-8e62-831da844354d,Tennessee judge to hear arguments about releasing Kilmar Abrego Garcia from pretrial detention,The Virginian-Pilot,6/18/2025,detention,https://www.pilotonline.com/2025/06/13/abrego-garcia-pretrial-detention-hearing/
