title,link,date,type
Feature Article: S&T Technology is Keeping our Skies Safe,https://www.dhs.gov/science-and-technology/news/2025/06/17/feature-article-st-technology-keeping-our-skies-safe,"June 17, 2025",Press Releases
DHS Arrests Dangerous Criminal Illegal Aliens who Escaped from Delaney Hall Detention Facility,https://www.dhs.gov/news/2025/06/16/dhs-arrests-dangerous-criminal-illegal-aliens-who-escaped-delaney-hall-detention,"June 16, 2025",Press Releases
"DHS Debunks Fake News Demonizing ICE Officers, Sets the Record Straight on L.A. Operations",https://www.dhs.gov/news/2025/06/16/dhs-debunks-fake-news-demonizing-ice-officers-sets-record-straight-la-operations,"June 16, 2025",Press Releases
"DHS Bolsters America’s Supply Chains, Critical Infrastructure, and Domestic Industry Through Arctic ICE Pact",https://www.dhs.gov/news/2025/06/16/dhs-bolsters-americas-supply-chains-critical-infrastructure-and-domestic-industry,"June 16, 2025",Press Releases
"Law Enforcement Offers $10,000 Reward for Information Leading to the Arrest of 4 Dangerous Criminal Illegal Aliens who Escaped from Delaney Hall Detention Facility",https://www.dhs.gov/news/2025/06/13/law-enforcement-offers-10000-reward-information-leading-arrest-4-dangerous-criminal,"June 13, 2025",Press Releases
"DHS Issues Notices of Termination for the CHNV Parole Program, Encourages Parolees to Self-Deport Immediately",https://www.dhs.gov/news/2025/06/12/dhs-issues-notices-termination-chnv-parole-program-encourages-parolees-self-deport,"June 12, 2025",Press Releases
VIDEO: DHS Arrests Christian Cerna-Camacho for Allegedly Punching CBP Officer during L.A. Riots,https://www.dhs.gov/news/2025/06/12/video-dhs-arrests-christian-cerna-camacho-allegedly-punching-cbp-officer-during-la,"June 12, 2025",Press Releases
WANTED: FBI Reward for Information Leading to Arrest of Elpidio Reyna for Allegedly Throwing Rocks and Improvised Explosives at Federal Law Enforcement,https://www.dhs.gov/news/2025/06/11/wanted-fbi-reward-information-leading-arrest-elpidio-reyna-allegedly-throwing-rocks,"June 11, 2025",Press Releases
"Thousands Turn Out For DHS Career Expo, Defying Politicians’ Anti-Cop Rhetoric",https://www.dhs.gov/news/2025/06/11/thousands-turn-out-dhs-career-expo-defying-politicians-anti-cop-rhetoric,"June 11, 2025",Press Releases
"DHS Reveals More Heinous Criminal Illegal Aliens Including a Murderer, Pedophile, and Drug Traffickers Arrested during Los Angeles Operation",https://www.dhs.gov/news/2025/06/11/dhs-reveals-more-heinous-criminal-illegal-aliens-including-murderer-pedophile-and,"June 11, 2025",Press Releases
ICE Arrests Illegal Alien for Molotov Cocktail Attack on Law Enforcement Caught on Video,https://www.dhs.gov/news/2025/06/11/ice-arrests-illegal-alien-molotov-cocktail-attack-law-enforcement-caught-video,"June 11, 2025",Press Releases
"DHS Sets the Record Straight on LA Riots, Condemns Violence Against Law Enforcement, Destruction of Property and Threats to ICE Agents",https://www.dhs.gov/news/2025/06/10/dhs-sets-record-straight-la-riots-condemns-violence-against-law-enforcement,"June 10, 2025",Press Releases
Feature Article: Testing New Technologies that Help Law Enforcement See Through Walls,https://www.dhs.gov/science-and-technology/news/2025/06/10/feature-article-testing-new-technologies-help-law-enforcement-see-through-walls,"June 10, 2025",Press Releases
DHS Announces It Will Forgive Failure to Depart Fines for Illegal Aliens who Self-Deport Through the CBP Home App,https://www.dhs.gov/news/2025/06/09/dhs-announces-it-will-forgive-failure-depart-fines-illegal-aliens-who-self-deport,"June 9, 2025",Press Releases
ICE Continues to Arrest Vicious Illegal Alien Criminals as Rioters Continue to Disrupt Law Enforcement,https://www.dhs.gov/news/2025/06/09/ice-continues-arrest-vicious-illegal-alien-criminals-rioters-continue-disrupt-law,"June 9, 2025",Press Releases
Criminal Illegal Alien Arrested during Los Angeles ICE Operation Committed Notorious Gang-Affiliated Murder of Two Teenagers at a Graduation Party,https://www.dhs.gov/news/2025/06/09/criminal-illegal-alien-arrested-during-los-angeles-ice-operation-committed,"June 9, 2025",Press Releases
"ICE Captures Worst of the Worst Illegal Alien Criminals in Los Angeles Including Murderers, Sex Offenders, and Other Violent Criminals",https://www.dhs.gov/news/2025/06/08/ice-captures-worst-worst-illegal-alien-criminals-los-angeles-including-murderers,"June 8, 2025",Press Releases
"DHS Releases Statement on Violent Rioters Assaulting ICE Officers in Los Angeles, CA and Calls on Democrat Politicians to Tone Down Dangerous Rhetoric About ICE",https://www.dhs.gov/news/2025/06/07/dhs-releases-statement-violent-rioters-assaulting-ice-officers-los-angeles-ca-and,"June 7, 2025",Press Releases
DHS and Idaho Team up in Joint Immigration Enforcement Operation,https://www.dhs.gov/news/2025/06/06/dhs-and-idaho-team-joint-immigration-enforcement-operation,"June 6, 2025",Press Releases
Operation Patriot Results in Numerous Arrests of Criminal Illegal Aliens with Detainers that Were Ignored Due to Sanctuary Policies,https://www.dhs.gov/news/2025/06/06/operation-patriot-results-numerous-arrests-criminal-illegal-aliens-detainers-were,"June 6, 2025",Press Releases
Secretary Noem Saves American Taxpayers Hundreds of Millions by Negotiating New Contract for the Coast Guard,https://www.dhs.gov/news/2025/06/05/secretary-noem-saves-american-taxpayers-hundreds-millions-negotiating-new-contract,"June 5, 2025",Press Releases
DHS Confirms Individual Wanted in Hit-and-Run with Pedestrian in Nashville is an Illegal Alien from Venezuela,https://www.dhs.gov/news/2025/06/05/dhs-confirms-individual-wanted-hit-and-run-pedestrian-nashville-illegal-alien,"June 5, 2025",Press Releases
Secretary Noem Announces ICE Detains Boulder Terrorist Soliman’s Family,https://www.dhs.gov/news/2025/06/04/secretary-noem-announces-ice-detains-boulder-terrorist-solimans-family,"June 4, 2025",Press Releases
ICE Lodges Detainer for Illegal Alien Charged with Child Rape in Massachusetts,https://www.dhs.gov/news/2025/06/04/ice-lodges-detainer-illegal-alien-charged-child-rape-massachusetts,"June 4, 2025",Press Releases
DHS Unearths TSA Corruption: Sitting US Senator’s Husband Received Blanket Exemption from National Security Review After Traveling with Known or Suspected Terrorist,https://www.dhs.gov/news/2025/06/04/dhs-unearths-tsa-corruption-sitting-us-senators-husband-received-blanket-exemption,"June 4, 2025",Press Releases
ICE Operation Results in More Than 70 Illegal Alien Arrests at Cartel-Run Night Club near Charleston,https://www.dhs.gov/news/2025/06/03/ice-operation-results-more-70-illegal-alien-arrests-cartel-run-night-club-near,"June 3, 2025",Press Releases
"In the Wake of Colorado Terrorist Attack Allegedly Committed by Illegal Alien, DHS Announces Revamping of ICE Tip Line",https://www.dhs.gov/news/2025/06/02/wake-colorado-terrorist-attack-allegedly-committed-illegal-alien-dhs-announces,"June 2, 2025",Press Releases
Delivering Tools to Prepare the Coast Guard for a Bioagent Incident,https://www.dhs.gov/science-and-technology/news/2025/06/02/delivering-tools-prepare-coast-guard-bioagent-incident,"June 2, 2025",Blog
DHS Exposes Sanctuary Jurisdictions Defying Federal Immigration Law,https://www.dhs.gov/news/2025/05/29/dhs-exposes-sanctuary-jurisdictions-defying-federal-immigration-law,"May 29, 2025",Press Releases
ICYMI: Happy 101st Birthday to the U.S. Border Patrol,https://www.dhs.gov/news/2025/05/29/icymi-happy-101st-birthday-us-border-patrol,"May 29, 2025",Press Releases
"DHS Secretary Noem Doubles Down and Escalates Action Against Harvard for their Continued Antisemitic Behavior, Fostering Violence, and CCP Coordination",https://www.dhs.gov/news/2025/05/29/dhs-secretary-noem-doubles-down-and-escalates-action-against-harvard-their,"May 29, 2025",Press Releases
ICE Lodges Detainers Against Two Illegal Aliens Involved in Hit and Run Killing 18-Year-Old Air Force Academy Cadet Candidate Ava Moore over Memorial Day Weekend,https://www.dhs.gov/news/2025/05/28/ice-lodges-detainers-against-two-illegal-aliens-involved-hit-and-run-killing-18,"May 28, 2025",Press Releases
Secretary Noem Releases Statement After ICE Arrests Illegal Alien who Threatened to Assassinate President Donald J. Trump,https://www.dhs.gov/news/2025/05/28/secretary-noem-releases-statement-after-ice-arrests-illegal-alien-who-threatened,"May 28, 2025",Press Releases
"Secretary Noem Honors Nicholas Quets, a U.S. Marine Corps Veteran Murdered by the Sinaloa Cartel",https://www.dhs.gov/news/2025/05/28/secretary-noem-honors-nicholas-quets-us-marine-corps-veteran-murdered-sinaloa,"May 28, 2025",Press Releases
READOUT: Secretary Kristi Noem Visits 4 Countries Focused on Securing the U.S. Homeland,https://www.dhs.gov/news/2025/05/27/readout-secretary-kristi-noem-visits-4-countries-focused-securing-us-homeland,"May 27, 2025",Press Releases
Exploring Gen AI Across the New Tech Frontier,https://www.dhs.gov/science-and-technology/news/2025/05/27/exploring-gen-ai-across-new-tech-frontier,"May 27, 2025",Blog
President Trump and Secretary Noem Recognize 101 Years of Border Patrol,https://www.dhs.gov/news/2025/05/27/president-trump-and-secretary-noem-recognize-101-years-border-patrol,"May 27, 2025",Press Releases
DHS Releases Documents Detailing the Rap Sheets of 8 Criminal Illegal Aliens after Activist Judge Ruling Halts their Deportation,https://www.dhs.gov/news/2025/05/23/dhs-releases-documents-detailing-rap-sheets-8-criminal-illegal-aliens-after,"May 23, 2025",Press Releases
Harvard University Loses Student and Exchange Visitor Program Certification for Pro-Terrorist Conduct,https://www.dhs.gov/news/2025/05/22/harvard-university-loses-student-and-exchange-visitor-program-certification-pro,"May 22, 2025",Press Releases
"DHS Reacts to Activist Judge Ruling to Halt the Deportation of Barbaric Criminal Illegal Aliens Including Murderers, Rapists, and Pedophiles",https://www.dhs.gov/news/2025/05/21/dhs-reacts-activist-judge-ruling-halt-deportation-barbaric-criminal-illegal-aliens,"May 21, 2025",Press Releases
ICE Lodges Detainer for 24-year-old Illegal Alien Posing as Teenager in Ohio,https://www.dhs.gov/news/2025/05/21/ice-lodges-detainer-24-year-old-illegal-alien-posing-teenager-ohio,"May 21, 2025",Press Releases
"DHS Sets the Record Straight on Media Frenzy over Deportation Flights for Worst of the Worst Including Murderers, Rapists, and Pedophiles",https://www.dhs.gov/news/2025/05/21/dhs-sets-record-straight-media-frenzy-over-deportation-flights-worst-worst,"May 21, 2025",Press Releases
"ICE Arrests Man Charged with Vehicular Homicide in the Death of Minnesota Mom, Victoria Eileen Harwell",https://www.dhs.gov/news/2025/05/20/ice-arrests-man-charged-vehicular-homicide-death-minnesota-mom-victoria-eileen,"May 20, 2025",Press Releases
DHS Hits Back at Tim Walz’s Dangerous Rhetoric Comparing ICE to Gestapo,https://www.dhs.gov/news/2025/05/19/dhs-hits-back-tim-walzs-dangerous-rhetoric-comparing-ice-gestapo,"May 19, 2025",Press Releases
"Project Homecoming Charter Flight Brings Self-Deporters to Honduras, Colombia",https://www.dhs.gov/news/2025/05/19/project-homecoming-charter-flight-brings-self-deporters-honduras-colombia,"May 19, 2025",Press Releases
"ICE Arrests Gang Members, Drug Traffickers, Violent Criminal Illegal Aliens in Sanctuary State Massachusetts",https://www.dhs.gov/news/2025/05/19/ice-arrests-gang-members-drug-traffickers-violent-criminal-illegal-aliens-sanctuary,"May 19, 2025",Press Releases
"ICE Arrests Criminal Illegal Aliens Including Rapists, Kidnappers, and Gang Members in Sanctuary Cities",https://www.dhs.gov/news/2025/05/19/ice-arrests-criminal-illegal-aliens-including-rapists-kidnappers-and-gang-members,"May 19, 2025",Press Releases
S&T Releases New Tool to Strengthen Global Navigation Satellite Systems,https://www.dhs.gov/science-and-technology/news/2025/05/19/st-releases-new-tool-strengthen-global-navigation-satellite-systems,"May 19, 2025",Press Releases
ICE Arrests MS-13 Gang Member with Extensive Rap Sheet in Maryland After Sanctuary Politicians Allow Repeated Arrest and Release,https://www.dhs.gov/news/2025/05/18/ice-arrests-ms-13-gang-member-extensive-rap-sheet-maryland-after-sanctuary,"May 18, 2025",Press Releases
"The U.S. Border Patrol, the U.S. Secret Service, and the U.S. Coast Guard are Breaking Recruitment Records Under President Trump and Secretary Noem",https://www.dhs.gov/news/2025/05/16/us-border-patrol-us-secret-service-and-us-coast-guard-are-breaking-recruitment,"May 16, 2025",Press Releases
FACT CHECK: DHS Requests to Replace 20-Year-Old Coast Guard Jet is for Safety,https://www.dhs.gov/news/2025/05/16/fact-check-dhs-requests-replace-20-year-old-coast-guard-jet-safety,"May 16, 2025",Press Releases
DHS Debunks Fake News Narratives About Law Enforcement During Police Week,https://www.dhs.gov/news/2025/05/16/dhs-debunks-fake-news-narratives-about-law-enforcement-during-police-week,"May 16, 2025",Press Releases
FAKE NEWS FRIDAY: DHS Torches Latest Media Hoax,https://www.dhs.gov/news/2025/05/16/fake-news-friday-dhs-torches-latest-media-hoax,"May 16, 2025",Press Releases
Six Illegal Aliens Charged For Brutal Murder Of South Carolina Mother in Random Attempted Robbery,https://www.dhs.gov/news/2025/05/15/six-illegal-aliens-charged-brutal-murder-south-carolina-mother-random-attempted,"May 15, 2025",Press Releases
DHS S&T Delivers New Capability for Detecting Presence of Life to Law Enforcement,https://www.dhs.gov/science-and-technology/news/2025/05/15/dhs-st-delivers-new-capability-detecting-presence-life-law-enforcement,"May 15, 2025",Press Releases
U.S. Secret Service Applications Jump 200% Since President Trump’s Inauguration,https://www.dhs.gov/news/2025/05/14/us-secret-service-applications-jump-200-president-trumps-inauguration,"May 14, 2025",Press Releases
DHS Reminds Congressional Members of ICE’s Guidelines to Schedule Tours of ICE Detention Facilities,https://www.dhs.gov/news/2025/05/14/dhs-reminds-congressional-members-ices-guidelines-schedule-tours-ice-detention,"May 14, 2025",Press Releases
"New York Times “Reporting” Fails to Mention ICE Arrests of Criminal Illegal Aliens Charged with Kidnapping, Assault, Firearms Offenses, and Theft",https://www.dhs.gov/news/2025/05/14/new-york-times-reporting-fails-mention-ice-arrests-criminal-illegal-aliens-charged,"May 14, 2025",Press Releases
DHS Files Emergency SCOTUS Request for Immediate Deportations,https://www.dhs.gov/news/2025/05/13/dhs-files-emergency-scotus-request-immediate-deportations,"May 13, 2025",Press Releases
"ICYMI-Deputy Secretary Edgar: “An Illegal Immigrant Killed Two Teenagers In My Community. Under The Trump Administration, He Will Face Justice”",https://www.dhs.gov/news/2025/05/13/icymi-deputy-secretary-edgar-illegal-immigrant-killed-two-teenagers-my-community,"May 13, 2025",Press Releases
DHS Lands Legal Victory in IRS Data Sharing Case: “Win for the American People and for Common Sense”,https://www.dhs.gov/news/2025/05/13/dhs-lands-legal-victory-irs-data-sharing-case-win-american-people-and-common-sense,"May 13, 2025",Press Releases
"DHS Announces Successful Operation with 287g Partners in Nashville Resulting in Arrests of MS-13 Affiliate, Murderer, Sex Offenders, and Illegals with Assault Convictions",https://www.dhs.gov/news/2025/05/13/dhs-announces-successful-operation-287g-partners-nashville-resulting-arrests-ms-13,"May 13, 2025",Press Releases
Feature Article: Ensuring Clear Communications for Mission Success,https://www.dhs.gov/science-and-technology/news/2025/05/13/feature-article-ensuring-clear-communications-mission-success,"May 13, 2025",Press Releases
ICE Arrests ‘Worst of the Worst’ Criminal Aliens in Hawaii,https://www.dhs.gov/news/2025/05/12/ice-arrests-worst-worst-criminal-aliens-hawaii,"May 12, 2025",Press Releases
Department of Homeland Security Investigates State of California for Providing Federal Benefits to Illegal Aliens,https://www.dhs.gov/news/2025/05/12/department-homeland-security-investigates-state-california-providing-federal,"May 12, 2025",Press Releases
Identity Technology Challenges Are Accelerating Long-Term Results,https://www.dhs.gov/science-and-technology/news/2025/05/12/identity-technology-challenges-are-accelerating-long-term-results,"May 12, 2025",Blog
DHS Terminating Temporary Protected Status for Afghanistan,https://www.dhs.gov/news/2025/05/12/dhs-terminating-temporary-protected-status-afghanistan,"May 12, 2025",Press Releases
Homeland Security Awards $86.1 Million in Disaster Assistance,https://www.dhs.gov/news/2025/05/12/homeland-security-awards-861-million-disaster-assistance,"May 12, 2025",Press Releases
DHS Releases Records of TdA Associate Deported to CECOT,https://www.dhs.gov/news/2025/05/12/dhs-releases-records-tda-associate-deported-cecot,"May 12, 2025",Press Releases
On Mothers’ Day DHS Honors Tammy Nobles and All the Mothers Who Lost Loved Ones to Illegal Alien Crime,https://www.dhs.gov/news/2025/05/10/mothers-day-dhs-honors-tammy-nobles-and-all-mothers-who-lost-loved-ones-illegal,"May 10, 2025",Press Releases
ACLU-Supported Lawsuit Over False Claims that ICE Deported U.S. Citizens Is Dropped,https://www.dhs.gov/news/2025/05/10/aclu-supported-lawsuit-over-false-claims-ice-deported-us-citizens-dropped,"May 10, 2025",Press Releases
Members of Congress Break into Delaney Hall Detention Center,https://www.dhs.gov/news/2025/05/09/members-congress-break-delaney-hall-detention-center,"May 9, 2025",Press Releases
THE REAL STORY: DHS Sets the Record Straight on Terrorist Sympathizer and Leader of the Columbia Pro-Terrorist Riots Mohsen Mahdawi,https://www.dhs.gov/news/2025/05/09/real-story-dhs-sets-record-straight-terrorist-sympathizer-and-leader-columbia-pro,"May 9, 2025",Press Releases
Feature Article: New Platform to Modernize National Fire Data and Intelligence,https://www.dhs.gov/science-and-technology/news/2025/05/08/feature-article-new-platform-modernize-national-fire-data-and-intelligence,"May 8, 2025",Press Releases
Secretary Noem Puts Sanctuary City Leaders on Notice: Time to Put Americans First,https://www.dhs.gov/news/2025/05/07/secretary-noem-puts-sanctuary-city-leaders-notice-time-put-americans-first,"May 7, 2025",Press Releases
TSA Begins REAL ID Full Enforcement,https://www.dhs.gov/news/2025/05/07/tsa-begins-real-id-full-enforcement,"May 7, 2025",Press Releases
WATCH NOW: Secretary Noem Calls Out Governor J.B. Pritzker’s and his Sanctuary Policies That Put Illegal Aliens Before Americans,https://www.dhs.gov/news/2025/05/07/watch-now-secretary-noem-calls-out-governor-jb-pritzkers-and-his-sanctuary-policies,"May 7, 2025",Press Releases
DHS Makes Common Sense Courthouse Arrests of Criminal Illegal Aliens,https://www.dhs.gov/news/2025/05/06/dhs-makes-common-sense-courthouse-arrests-criminal-illegal-aliens,"May 6, 2025",Press Releases
Secretary Noem Remembers Americans Killed by Illegal Aliens Driving Under the Influence,https://www.dhs.gov/news/2025/05/06/secretary-noem-remembers-americans-killed-illegal-aliens-driving-under-influence,"May 6, 2025",Press Releases
Secretary Noem Requests Death Penalty Against Alleged Human Smugglers Whose Actions Resulted in the Death of at Least Three Individuals,https://www.dhs.gov/news/2025/05/06/secretary-noem-requests-death-penalty-against-alleged-human-smugglers-whose-actions,"May 6, 2025",Press Releases
DHS Announces Historic Travel Assistance and Stipend for Voluntary Self-Deportation,https://www.dhs.gov/news/2025/05/05/dhs-announces-historic-travel-assistance-and-stipend-voluntary-self-deportation,"May 5, 2025",Press Releases
100 Days of Secretary Noem: Making America Safe Again,https://www.dhs.gov/news/2025/05/05/100-days-secretary-noem-making-america-safe-again,"May 5, 2025",Press Releases
"ICE Lodges Detainers Against Violent Aliens Over Corpse Rape, Shooting Spree",https://www.dhs.gov/news/2025/05/01/ice-lodges-detainers-against-violent-aliens-over-corpse-rape-shooting-spree,"May 1, 2025",Press Releases
ICYMI: ICE Targets Major Human and Drug Smuggling Property In Oklahoma City,https://www.dhs.gov/news/2025/05/01/icymi-ice-targets-major-human-and-drug-smuggling-property-oklahoma-city,"May 1, 2025",Press Releases
100 Days of Fighting Fake News,https://www.dhs.gov/news/2025/04/30/100-days-fighting-fake-news,"April 30, 2025",Press Releases
Reuters “Reporting” Fails to Mention that the Biden Administration Released Two Tren de Aragua Gang Members into American Communities,https://www.dhs.gov/news/2025/04/30/reuters-reporting-fails-mention-biden-administration-released-two-tren-de-aragua,"April 30, 2025",Press Releases
Feature Article: S&T Is Modernizing Threat Alerts Using Artificial Intelligence,https://www.dhs.gov/science-and-technology/news/2025/04/29/feature-article-st-modernizing-threat-alerts-using-artificial-intelligence,"April 29, 2025",Press Releases
100 Days of Making America Safe Again,https://www.dhs.gov/news/2025/04/29/100-days-making-america-safe-again,"April 29, 2025",Press Releases
Fact Check - DHS is NOT Deporting American Children,https://www.dhs.gov/news/2025/04/29/fact-check-dhs-not-deporting-american-children,"April 29, 2025",Press Releases
President Trump Appoints New Members to Federal Emergency Management Agency Review Council,https://www.dhs.gov/news/2025/04/28/president-trump-appoints-new-members-federal-emergency-management-agency-review,"April 28, 2025",Press Releases
100 Days of The Most Secure Border in American History,https://www.dhs.gov/news/2025/04/28/100-days-most-secure-border-american-history,"April 28, 2025",Press Releases
Deputy Secretary Edgar Joins HSI Drug Trafficking Warrant Operation in Los Angeles,https://www.dhs.gov/news/2025/04/27/deputy-secretary-edgar-joins-hsi-drug-trafficking-warrant-operation-los-angeles,"April 27, 2025",Press Releases
DHS Sweeps into Action to Protect Child from Tren De Aragua Parents,https://www.dhs.gov/news/2025/04/26/dhs-sweeps-action-protect-child-tren-de-aragua-parents,"April 26, 2025",Press Releases
"Milwaukee Judge Obstructed Arrest of Illegal Alien Accused of Strangulation, Battery, and Domestic Abuse",https://www.dhs.gov/news/2025/04/25/milwaukee-judge-obstructed-arrest-illegal-alien-accused-strangulation-battery-and,"April 25, 2025",Press Releases
StreamView: Fighting Human Trafficking in Real Time,https://www.dhs.gov/science-and-technology/news/2025/04/24/streamview-fighting-human-trafficking-real-time,"April 24, 2025",Blog
Feature Article: Detecting and Mitigating Drones on the Border,https://www.dhs.gov/science-and-technology/news/2025/04/22/feature-article-detecting-and-mitigating-drones-border,"April 22, 2025",Press Releases
DHS Releases Bombshell Investigative Report on Kilmar Abrego Garcia Suspected Human Trafficking Incident,https://www.dhs.gov/news/2025/04/18/dhs-releases-bombshell-investigative-report-kilmar-abrego-garcia-suspected-human,"April 18, 2025",Press Releases
Angel Moms Patty Morin and Tammy Nobles Share Personal Accounts of Illegal Alien Crime,https://www.dhs.gov/news/2025/04/17/angel-moms-patty-morin-and-tammy-nobles-share-personal-accounts-illegal-alien-crime,"April 17, 2025",Press Releases
"DHS Marks One-Year Milestone of Know2Protect® Campaign, Strengthening Nationwide Efforts to Combat Online Child Exploitation",https://www.dhs.gov/news/2025/04/17/dhs-marks-one-year-milestone-know2protectr-campaign-strengthening-nationwide,"April 17, 2025",Press Releases
Fact Sheet: How DHS is Combating Child Exploitation and Abuse,https://www.dhs.gov/news/2025/04/17/fact-sheet-how-dhs-combating-child-exploitation-and-abuse,"April 17, 2025",Press Releases
3D Maker Workshop Highlights Innovations for Bomb Squads,https://www.dhs.gov/science-and-technology/news/2025/04/16/3d-maker-workshop-highlights-innovations-bomb-squads,"April 16, 2025",Blog
"While Mainstream Media Defends MS-13 Gang Member, DHS Stands with the Victims of Illegal Alien Crimes",https://www.dhs.gov/news/2025/04/15/while-mainstream-media-defends-ms-13-gang-member-dhs-stands-victims-illegal-alien,"April 15, 2025",Press Releases
ICYMI: DHS Sets the Record Straight about Kilmar Abrego Garcia,https://www.dhs.gov/news/2025/04/14/icymi-dhs-sets-record-straight-about-kilmar-abrego-garcia,"April 14, 2025",Press Releases
DHS Announces New Ad Campaign for Secret Service Recruitment,https://www.dhs.gov/news/2025/04/14/dhs-announces-new-ad-campaign-secret-service-recruitment,"April 14, 2025",Press Releases
Secretary Noem Announces Relaunch of VOICE Office Shuttered by Biden,https://www.dhs.gov/news/2025/04/10/secretary-noem-announces-relaunch-voice-office-shuttered-biden,"April 10, 2025",Press Releases
Victims of Immigration Crime Engagement (VOICE) Press Conference,https://www.dhs.gov/news/2025/04/09/victims-immigration-crime-engagement-voice-press-conference,"April 9, 2025",Event
March Madness Safety is a Whole Different Ballgame,https://www.dhs.gov/science-and-technology/news/2025/04/08/march-madness-safety-whole-different-ballgame,"April 8, 2025",Blog
CWMD Meets with Chicago Area BioWatch and STC Partners,https://www.dhs.gov/news/2025/04/04/cwmd-meets-chicago-area-biowatch-and-stc-partners,"April 4, 2025",Press Releases
Strengthening School and Community Safety: Highlights from the 2024 Eastern West Virginia Safety Summit,https://www.dhs.gov/news/2025/04/02/strengthening-school-and-community-safety-highlights-2024-eastern-west-virginia,"April 2, 2025",Blog
Regional Prevention Coordinators Increase Awareness of Terrorism and Targeted Violence Prevention,https://www.dhs.gov/news/2025/04/02/regional-prevention-coordinators-increase-awareness-terrorism-and-targeted-violence,"April 2, 2025",Blog
