title,link,date,type
"Written testimony of ICE for a Senate Committee on Homeland Security and Governmental Affairs, Permanent Subcommittee on Investigations hearing titled “U.S. Vulnerabilities to Money Laundering, Drugs, and Terrorist Financing: HSBC Case History”",https://www.dhs.gov/news/2012/07/16/written-testimony-ice-senate-committee-homeland-security-and-governmental-affairs,"July 16, 2012",Testimony
"Written testimony of TSA for a House Committee on Homeland Security, Subcommittee on Transportation Security hearing titled “A Decade After 9/11 Could American Flight Schools Still Unknowingly Be Training Terrorists?”",https://www.dhs.gov/news/2012/07/16/written-testimony-tsa-house-committee-homeland-security-subcommittee-transportation,"July 16, 2012",Testimony
Written testimony of ICE HSI NSI Assistant Director John Woods for a closed hearing titled “Securing Ammonium Nitrate: Using Lessons Learned in Afghanistan to Protect the Homeland from IEDs”,https://www.dhs.gov/news/2012/07/12/written-testimony-ice-hsi-nsi-assistant-director-john-woods-closed-hearing-titled,"July 12, 2012",Testimony
Written testimony of ICE Director John Morton for a House Homeland Security Subcommittee on Border and Maritime Security hearing titled “Building a Secure Community: How Can DHS Better Leverage State and Local Partnerships?”,https://www.dhs.gov/news/2012/07/09/written-testimony-ice-director-john-morton-house-homeland-security-subcommittee,"July 9, 2012",Testimony
"Written testimony of the TSA for a House Homeland Security, Subcommittee on Transportation Security hearing titled “Has TSA Met the Deadline to Provide expedited Screening to Military Service Members?”",https://www.dhs.gov/news/2012/07/09/written-testimony-tsa-house-homeland-security-subcommittee-transportation-security,"July 9, 2012",Testimony
Written testimony of the U.S. Coast Guard for a House Transportation and Infrastructure Subcommittee on Coast Guard and Maritime Transportation hearing titled “A Review of Federal Maritime Domain Awareness Programs”,https://www.dhs.gov/news/2012/07/03/written-testimony-us-coast-guard-house-transportation-and-infrastructure,"July 3, 2012",Testimony
USCG and PLCY written testimony for a House Committee on Transportation and Infrastructure hearing titled “A Review of the Delays and Problems Associated with TSA's Transportation Worker Identification Credential (TWIC)”,https://www.dhs.gov/news/2012/06/27/uscg-and-plcy-written-testimony-house-committee-transportation-and-infrastructure,"June 27, 2012",Testimony
ICE written testimony for a House Committee on Homeland Security Subcommittee on Counterterrorism and Intelligence hearing titled “Economic Espionage: A Foreign Intelligence Threat to American Jobs and Homeland Security”,https://www.dhs.gov/news/2012/06/27/ice-written-testimony-house-committee-homeland-security-subcommittee,"June 27, 2012",Testimony
"Written testimony of the U.S. Coast Guard for a Senate Committee on Health, Education, Labor, and Pensions hearing titled “Forty Years and Counting: The Triumphs of Title IX”",https://www.dhs.gov/news/2012/06/22/written-testimony-us-coast-guard-senate-committee-health-education-labor-and,"June 22, 2012",Testimony
Statement for the Record of Principal Deputy Counterterrorism Coordinator John Cohen for a House Committee on Homeland Security hearing titled “The American Muslim Response to Hearings on Radicalization within their Community”,https://www.dhs.gov/news/2012/06/22/statement-record-principal-deputy-counterterrorism-coordinator-john-cohen-house,"June 22, 2012",Testimony
"Written testimony of the CBP, USCG, and ICE for a House Homeland Security Subcommittee on Oversight, Investigations, and Management hearing titled “U.S.-Caribbean Border: Open Road for Drug Traffickers and Terrorists”",https://www.dhs.gov/news/2012/06/20/written-testimony-cbp-uscg-and-ice-house-homeland-security-subcommittee-oversight,"June 20, 2012",Testimony
Written testimony of the Transportation Security Administration for a House Homeland Security Subcommittee on Transportation Security hearing titled ““Is TSA's Planned Purchase of CAT-BPSS a Wise Use of Taxpayer Dollars?”,https://www.dhs.gov/news/2012/06/18/written-testimony-transportation-security-administration-house-homeland-security,"June 18, 2012",Testimony
Written testimony of the U.S. Coast Guard for a House Homeland Security Subcommittee on Border and Maritime Security hearing titled “Threats to the Homeland: DHS’ Response to Innovative Tactics and Techniques”,https://www.dhs.gov/news/2012/06/18/written-testimony-us-coast-guard-house-homeland-security-subcommittee-border-and,"June 18, 2012",Testimony
Written testimony of the U.S. Immigration & Customs Enforcement for a House Homeland Security Subcommittee on Border and Maritime Security hearing titled “Border Security Threats to the Homeland: DHS’ Response to Innovative Tactics and Techniques”,https://www.dhs.gov/news/2012/06/15/written-testimony-us-immigration-customs-enforcement-house-homeland-security,"June 15, 2012",Testimony
Written testimony of the U.S. Customs & Border Protection for a House Homeland Security Subcommittee on Border and Maritime Security hearing titled “Border Security Threats to the Homeland: DHS’ Response to Innovative Tactics and Techniques”,https://www.dhs.gov/news/2012/06/15/written-testimony-us-customs-border-protection-house-homeland-security-subcommittee,"June 15, 2012",Testimony
Written testimony of the U.S. Coast Guard for a Senate Committee on Foreign Relations hearing titled “The Law of the Sea Convention (Treaty Doc. 103-39): Perspectives from the U.S. Military”,https://www.dhs.gov/news/2012/06/12/written-testimony-us-coast-guard-senate-committee-foreign-relations-hearing-titled,"June 12, 2012",Testimony
"Written testimony of the Federal Emergency Management Agency for a House Homeland Security Subcommittee on Emergency Preparedness, Response and Communications hearing titled “The National Preparedness Report: Assessing the State of Preparedness”",https://www.dhs.gov/news/2012/06/06/written-testimony-federal-emergency-management-agency-house-homeland-security,"June 6, 2012",Testimony
Written testimony of the U.S. Secret Service for a Senate Committee on Homeland Security and Governmental Affairs hearing titled “Secret Service on the Line: Restoring Trust and Confidence”,https://www.dhs.gov/news/2012/05/23/written-testimony-us-secret-service-senate-committee-homeland-security-and,"May 23, 2012",Testimony
"Written testimony of the U.S. Immigration and Customs Enforcement for a House Homeland Security Subcommittee on Border and Maritime Security field hearing titled ““Stopping the Flow of Illicit Drugs in Arizona by Leveraging State, Local and Federal In",https://www.dhs.gov/news/2012/05/21/written-testimony-us-immigration-and-customs-enforcement-house-homeland-security,"May 21, 2012",Testimony
"Written testimony of the U.S. Coast Guard for a Senate Commerce, Science, and Transportation Subcommittee on Oceans, Atmosphere, Fisheries, and Coast Guard hearing titled “Stemming the Tide: The U.S. Response to Tsunami Generated Marine Debris”",https://www.dhs.gov/news/2012/05/17/written-testimony-us-coast-guard-senate-commerce-science-and-transportation,"May 17, 2012",Testimony
"Written testimony of the U.S. Customs and Border Protection for a House Homeland Security Subcommittee on Oversight, Investigations, and Management hearing titled “Department of Homeland Security: An Examination of Ethical Standards”",https://www.dhs.gov/news/2012/05/17/written-testimony-us-customs-and-border-protection-house-homeland-security,"May 17, 2012",Testimony
"Written testimony of the U.S. Customs and Border Protection for a House Ways and Means Subcommittee on Trade hearing titled “Supporting Economic Growth and Job Creation through Customs Trade Modernization, Facilitation, and Enforcement”",https://www.dhs.gov/news/2012/05/17/written-testimony-us-customs-and-border-protection-house-ways-and-means,"May 17, 2012",Testimony
"Written testimony of the Federal Emergency Management Agency U.S. Fire Administration for a House Committee on Science, Space, and Technology hearing titled “Working for a Fire Safe America:  Examining United States Fire Administration Priorities”",https://www.dhs.gov/news/2012/05/17/written-testimony-federal-emergency-management-agency-us-fire-administration-house,"May 17, 2012",Testimony
"Written testimony of the U.S. Immigration and Customs Enforcement for a House Homeland Security Subcommittee on Oversight, Investigations, and Management hearing titled “Department of Homeland Security: An Examination of Ethical Standards”",https://www.dhs.gov/news/2012/05/17/written-testimony-us-immigration-and-customs-enforcement-house-homeland-security,"May 17, 2012",Testimony
"Written testimony of the U.S. Immigration and Customs Enforcement for a House Ways and Means Subcommittee on Trade hearing titled “Supporting Economic Growth and Job Creation through Customs Trade Modernization, Facilitation, and Enforcement”",https://www.dhs.gov/news/2012/05/17/written-testimony-us-immigration-and-customs-enforcement-house-ways-and-means,"May 17, 2012",Testimony
"Written testimony of the Transportation Security Administration for a House Homeland Security Subcommittee on Oversight, Investigations, and Management hearing titled “Department of Homeland Security: An Examination of Ethical Standards”",https://www.dhs.gov/news/2012/05/17/written-testimony-transportation-security-administration-house-homeland-security,"May 17, 2012",Testimony
Written testimony of the U.S. Coast Guard for a House Transportation and Infrastructure Subcommittee on Coast Guard and Maritime Transportation hearing titled “Creating American Jobs and Assuring the Safety and Security of America's Waterways: A Review,https://www.dhs.gov/news/2012/05/16/written-testimony-us-coast-guard-house-transportation-and-infrastructure,"May 16, 2012",Testimony
Written testimony of the Transportation Security Administration for a House Homeland Security Subcommittee on Transportation Security hearing titled “Access Control Point Breaches at Our Nation's Airports: Anomalies or Systemic Failures?”,https://www.dhs.gov/news/2012/05/16/written-testimony-transportation-security-administration-house-homeland-security,"May 16, 2012",Testimony
"Written testimony of U.S. Coast Guard Commandant Admiral Papp for a Senate Appropriations, Subcommittee on Homeland Security hearing on the Coast Guard’s Fiscal Year 2013 budget request",https://www.dhs.gov/news/2012/05/09/written-testimony-us-coast-guard-commandant-admiral-papp-senate-appropriations,"May 9, 2012",Testimony
"Written testimony of the Transportation Security Administration for a House Committee on Oversight and Government Reform, and House Committee on Transportation and Infrastructure joint hearing titled “TSA Oversight Part IV: Is TSA Effectively Procuring,",https://www.dhs.gov/news/2012/05/09/written-testimony-transportation-security-administration-house-committee-oversight,"May 9, 2012",Testimony
Written testimony of the Science and Technology Directorate for a House Homeland Security Joint Subcommittee hearing titled “First Responder Technologies” Ensuring a Prioritized Approach for Homeland Security Research and Development”,https://www.dhs.gov/news/2012/05/09/written-testimony-science-and-technology-directorate-house-homeland-security-joint,"May 9, 2012",Testimony
Written testimony of U.S. Customs and Border Protection for a House Homeland Security Subcommittee on Border and Maritime Security hearing titled “Measuring Border Security: U.S. Border Patrol’s New Strategic Plan and the Path Forward.”,https://www.dhs.gov/news/2012/05/08/written-testimony-us-customs-and-border-protection-house-homeland-security,"May 8, 2012",Testimony
"Written testimony of the Office of International Affairs for a House Homeland Security Subcommittee on Transportation Security hearing titled “Building Secure Partnerships in Travel, Commerce, and Trade with the Asia-Pacific Region”",https://www.dhs.gov/news/2012/05/08/written-testimony-office-international-affairs-house-homeland-security-subcommittee,"May 8, 2012",Testimony
"Written testimony of the Transportation Security Administration for a House Homeland Security Subcommittee on Transportation Security hearing titled “Building Secure Partnerships in Travel, Commerce, and Trade with the Asia-Pacific Region”",https://www.dhs.gov/news/2012/05/08/written-testimony-transportation-security-administration-house-homeland-security,"May 8, 2012",Testimony
Written testimony of the U.S. Customs and Border Protection for a House Homeland Security Subcommittee on Border and Maritime Security field hearing titled “Using Technology to Facilitate Trade and Enhance Security at Our Ports of Entry”,https://www.dhs.gov/news/2012/05/01/written-testimony-us-customs-and-border-protection-house-homeland-security,"May 1, 2012",Testimony
Written testimony of USCG for a House Transportation and Infrastructure Subcommittee on Coast Guard and Maritime Transportation hearing titled “Regulation of the Maritime Industry: Ensuring U.S. Job Growth while Improving Environmental and Worker Safety”,https://www.dhs.gov/news/2012/04/26/written-testimony-uscg-house-transportation-and-infrastructure-subcommittee-coast,"April 26, 2012",Testimony
Written testimony of the Science and Technology Directorate for a Senate Committee on Homeland Security and Governmental Affairs hearing titled “Biological Security: The Risk of Dual Use Research”,https://www.dhs.gov/news/2012/04/26/written-testimony-science-and-technology-directorate-senate-committee-homeland,"April 26, 2012",Testimony
Written testimony  of Department of Homeland Security Secretary Janet Napolitano for a Senate Committee on the Judiciary hearing titled “The Oversight of the Department of Homeland Security”,https://www.dhs.gov/news/2012/04/25/written-testimony-department-homeland-security-secretary-janet-napolitano-senate,"April 25, 2012",Testimony
"Written testimony of the Science and Technology Directorate for a House Committee on Homeland Security Subcommittee on Cybersecurity, Infrastructure Protection, and Security Technologies hearing titled “The DHS and DOE National Labs: Finding",https://www.dhs.gov/news/2012/04/19/written-testimony-science-and-technology-directorate-house-committee-homeland,"April 19, 2012",Testimony
"Written testimony of DHS Office of the Chief Information Officer, for a House Ways and Means Subcommittee on Human Resources hearing titled “The Use of Technology to Better Target Benefits and Eliminate Waste, Fraud, and Abuse.”",https://www.dhs.gov/news/2012/04/19/written-testimony-dhs-office-chief-information-officer-house-ways-and-means,"April 19, 2012",Testimony
"Written testimony of the Domestic Nuclear Detection Office for a House Committee on Homeland Security Subcommittee on Cybersecurity, Infrastructure Protection, and Security Technologies hearing titled “The DHS and DOE National Labs: Finding Efficiencies",https://www.dhs.gov/news/2012/04/19/written-testimony-domestic-nuclear-detection-office-house-committee-homeland,"April 19, 2012",Testimony
Written testimony of U.S. Immigration and Customs Enforcement for a House Judiciary Subcommittee on Immigration Policy and Enforcement hearing titled “Document Fraud In Employment Authorization: How an E-Verify Requirement Can Help.”,https://www.dhs.gov/news/2012/04/18/written-testimony-us-immigration-and-customs-enforcement-house-judiciary,"April 18, 2012",Testimony
"Written testimony of Office of Health Affairs for a House Homeland Security Subcommittee on Emergency Preparedness, Response, and Communications hearing titled “Taking Measure of Countermeasures (Part 3): Protecting the Protectors”",https://www.dhs.gov/news/2012/04/17/written-testimony-office-health-affairs-house-homeland-security-subcommittee,"April 17, 2012",Testimony
Written testimony of U.S. Customs and Border Protection for a House Homeland Security Subcommittee on Border and Maritime Security hearing titled “Boots on the Ground or Eyes in the Sky:  How Best to Utilize the National Guard to Achieve Operational Con,https://www.dhs.gov/news/2012/04/17/written-testimony-us-customs-and-border-protection-house-homeland-security,"April 17, 2012",Testimony
Statement for the record from the TSA for a House Veterans' Affairs Subcommittee on Economic Opportunity hearing,https://www.dhs.gov/news/2012/04/04/statement-record-tsa-house-veterans-affairs-subcommittee-economic-opportunity,"April 4, 2012",Testimony
Written testimony of U.S. Customs and Border Protection Acting Deputy Commissioner Thomas Winkowksi for a Senate Appropriations Subcommittee on Homeland Security hearing titled “Balancing Prosperity and Security:  Challenges for U.S. Air Travel in a 21s,https://www.dhs.gov/news/2012/04/03/written-testimony-us-customs-and-border-protection-acting-deputy-commissioner,"April 3, 2012",Testimony
"Written testimony of the PLCY for a Senate Committee on Appropriations, Subcommittee on Homeland Security hearing titled “Balancing Prosperity and Security: Challenges for U.S. Air Travel in a 21st Century Global Economy”",https://www.dhs.gov/news/2012/04/02/written-testimony-plcy-senate-committee-appropriations-subcommittee-homeland,"April 2, 2012",Testimony
Written testimony of Transportation Security Administration Administrator John Pistole for a Senate Appropriations Subcommittee on Homeland Security hearing titled “Balancing Prosperity and Security:  Challenges for U.S. Air Travel in a 21st Century Glo,https://www.dhs.gov/news/2012/04/02/written-testimony-transportation-security-administration-administrator-john-pistole,"April 2, 2012",Testimony
"Written testimony of the Office of Health Affairs (OHA) Assistant Secretary and Chief Medical Officer for a House Homeland Security Subcommittee on Emergency Preparedness, Response, and Communications hearing on the fiscal 2013 year budget request for the",https://www.dhs.gov/news/2012/03/29/written-testimony-office-health-affairs-oha-assistant-secretary-and-chief-medical,"March 29, 2012",Testimony
Written testimony of the U.S. Coast Guard Commandant for a House Transportation and Infrastructure Subcommittee on Coast Guard and Maritime Transportation hearing titled “Protecting Maritime Jobs and Enhancing Marine Safety in the Post-Budget Control Ac,https://www.dhs.gov/news/2012/03/29/written-testimony-us-coast-guard-commandant-house-transportation-and-infrastructure,"March 29, 2012",Testimony
Written testimony of Under Secretary for Management Rafael Borras for a House Appropriations Subcommittee on Homeland Security budget hearing titled “Department of Homeland Security Facilities”,https://www.dhs.gov/news/2012/03/29/written-testimony-under-secretary-management-rafael-borras-house-appropriations,"March 29, 2012",Testimony
Written testimony of the Office of the Chief Human Capital Officer Balanced Workforce Program Management Office Executive Director for a Senate Homeland Security and Governmental Affairs Subcommittee on Contracting Oversight hearing titled “Contractors:,https://www.dhs.gov/news/2012/03/29/written-testimony-office-chief-human-capital-officer-balanced-workforce-program,"March 29, 2012",Testimony
"Written testimony of Science and Technology Directorate Under Secretary Dr. Tara O’Toole, MD, MPH for a House Appropriations Subcommittee on Homeland Security budget hearing titled “Department of Homeland Security Facilities”",https://www.dhs.gov/news/2012/03/29/written-testimony-science-and-technology-directorate-under-secretary-dr-tara-otoole,"March 29, 2012",Testimony
Written testimony of the National Protection and Programs Directorate for a House Energy and Commerce Subcommittee on Communications and Technology hearing titled “Cybersecurity: Threats to Communications Networks and Public-Sector Responses”,https://www.dhs.gov/news/2012/03/28/written-testimony-national-protection-and-programs-directorate-house-energy-and,"March 28, 2012",Testimony
Written testimony of U.S. Immigration and Customs Enforcement for a House Judiciary Subcommittee on Immigration Policy and Enforcement hearing on Performance-Based National Detention Standards (PBNDS) 2011,https://www.dhs.gov/news/2012/03/27/written-testimony-us-immigration-and-customs-enforcement-house-judiciary,"March 27, 2012",Testimony
Written testimony of the Transportation Security Administration for a House Homeland Security Subcommittee on Transportation Security hearing titled “Rightsizing TSA Bureaucracy and Workforce Without Compromising Security”,https://www.dhs.gov/news/2012/03/27/written-testimony-transportation-security-administration-house-homeland-security,"March 27, 2012",Testimony
"Written testimony of Transportation Security Administration (TSA) for a joint House Committee on Oversight and Government Reform, and House Committee on Transportation and Infrastructure hearing titled: ""TSA Oversight Part III: Effective Security or Secur",https://www.dhs.gov/news/2012/03/26/written-testimony-transportation-security-administration-tsa-joint-house-committee,"March 26, 2012",Testimony
"Written testimony of DHS Chief Human Capital Officer for a House Homeland Security Subcommittee on Oversight, Investigations, and Management hearing titled ‘Building One DHS: Why is Employee Morale Low?”",https://www.dhs.gov/news/2012/03/22/written-testimony-dhs-chief-human-capital-officer-house-homeland-security,"March 22, 2012",Testimony
Written testimony of the Master Chief Petty Officer of the Coast Guard for a House Armed Services Subcommittee on Military Personnel hearing titled “Hazing in the United States Military”,https://www.dhs.gov/news/2012/03/22/written-testimony-master-chief-petty-officer-coast-guard-house-armed-services,"March 22, 2012",Testimony
Written testimony of DHS Secretary Janet Napolitano for a Senate Committee on Homeland Security and Governmental Affairs hearing on DHS’ Fiscal Year 2013 budget request,https://www.dhs.gov/news/2012/03/21/written-testimony-dhs-secretary-janet-napolitano-senate-committee-homeland-security,"March 21, 2012",Testimony
"Written testimony of the PLCY for a House Committee on the Judiciary, Subcommittee on Crime, Terrorism, and Homeland Security hearing titled “Secure Identification: The REAL ID Act's Minimum Standards for Driver's Licenses and Identification Cards”",https://www.dhs.gov/real-id/news/2012/03/21/written-testimony-plcy-house-committee-judiciary-subcommittee-crime-terrorism-and,"March 21, 2012",Testimony
"Written testimony of FEMA and NPPD for a House Committee on Homeland Security, Subcommittee on Emergency Preparedness, Response and Communications hearing titled “Ensuring the Transparency, Efficiency and Effectiveness of Homeland Security Grants”",https://www.dhs.gov/news/2012/03/20/written-testimony-fema-and-nppd-house-committee-homeland-security-subcommittee,"March 20, 2012",Testimony
Written testimony of the National Protection and Programs Directorate for a House Homeland Security Subcommittee on Counterterrorism and Intelligence field hearing titled “The Implications of Refinery Closures for U.S. Homeland Security and Critical Inf,https://www.dhs.gov/news/2012/03/19/written-testimony-national-protection-and-programs-directorate-house-homeland,"March 19, 2012",Testimony
"Written testimony of Federal Emergency Management Agency Administrator Craig Fugate for a House Committee on Appropriations, Subcommittee on Homeland Security hearing on The President’s Fiscal Year 2013 budget request for FEMA",https://www.dhs.gov/news/2012/03/16/written-testimony-federal-emergency-management-agency-administrator-craig-fugate,"March 16, 2012",Testimony
Written testimony of DHS Secretary Janet Napolitano for a Senate Appropriations Subcommittee on Homeland Security hearing on DHS’ Fiscal Year 2013 budget request,https://www.dhs.gov/news/2012/03/08/written-testimony-dhs-secretary-janet-napolitano-senate-appropriations-subcommittee,"March 8, 2012",Testimony
"Written Testimony of U.S. Secret Service Director Sullivan for a House Committee on Appropriations, Subcommittee on Homeland Security hearing on The President’s Fiscal Year 2013 budget request for the Secret Service.",https://www.dhs.gov/news/2012/03/08/written-testimony-us-secret-service-director-sullivan-house-committee,"March 8, 2012",Testimony
Written testimony of U.S. Immigration and Customs Enforcement (ICE) Director for a House Appropriations Subcommittee on Homeland Security hearing on ICE’s Fiscal Year 2013 budget request,https://www.dhs.gov/news/2012/03/08/written-testimony-us-immigration-and-customs-enforcement-ice-director-house,"March 8, 2012",Testimony
"Written testimony of NPPD Under Secretary for a House Homeland Security Subcommittee on Cybersecurity, Infrastructure Protection and Security Technologies hearing on CFATS",https://www.dhs.gov/news/2012/03/07/written-testimony-nppd-under-secretary-house-homeland-security-subcommittee,"March 7, 2012",Testimony
Written testimony of the Deputy Counterterrorism Coordinator and ICE Homeland Security Investigations Deputy Executive Associate Director for a House Homeland Security Subcommittee on Border and Maritime Security hearing on the problem of visa overstays,https://www.dhs.gov/news/2012/03/07/written-testimony-deputy-counterterrorism-coordinator-and-ice-homeland-security,"March 7, 2012",Testimony
"Written testimony of U.S. Coast Guard Commandant Papp for a House Appropriations, Subcommittee on Homeland Security hearing on the Coast Guard’s Fiscal Year 2013 budget request",https://www.dhs.gov/news/2012/03/07/written-testimony-us-coast-guard-commandant-papp-house-appropriations-subcommittee,"March 7, 2012",Testimony
