title,link,date,type
"Written testimony of USCG for a House Committee Foreign Affairs, joint Subcommittee hearing titled “Charting the Arctic: Security, Economic, and Resource Opportunities”",https://www.dhs.gov/news/2015/11/17/written-testimony-uscg-house-committee-foreign-affairs-joint-subcommittee-hearing,"November 17, 2015",Testimony
Written testimony of CBP for a Senate Caucus on International Narcotics Control hearing titled “Drug Trafficking Across the Southwest Border and Oversight of U.S. Counterdrug Assistance to Mexico”,https://www.dhs.gov/news/2015/11/17/written-testimony-cbp-senate-caucus-international-narcotics-control-hearing-titled,"November 17, 2015",Testimony
Written testimony of USSS Director for a joint House and Senate Homeland Security Subcommittees hearing titled “Examining Ongoing Challenges at the U.S. Secret Service and their Government Wide Implications”,https://www.dhs.gov/news/2015/11/17/written-testimony-usss-director-joint-house-and-senate-homeland-security,"November 17, 2015",Testimony
"Written testimony of TSA for a House Committee on Homeland Security, Subcommittee on Transportation Security hearing titled “Assessing TSA's Management and Implementation of the Screening Partnership Program”",https://www.dhs.gov/news/2015/11/17/written-testimony-tsa-house-committee-homeland-security-subcommittee-transportation,"November 17, 2015",Testimony
Written testimony of CBP for a House Homeland Security Subcommittee on Border and Maritime Security hearing titled “A New Approach to Increase Trade and Security: An Examination of CBP’s Public-Private Partnerships”,https://www.dhs.gov/news/2015/11/04/written-testimony-cbp-house-homeland-security-subcommittee-border-and-maritime,"November 4, 2015",Testimony
Written testimony of TSA Administrator for a House Committee on Oversight and Government Reform hearing titled “TSA:  Security Gaps”,https://www.dhs.gov/news/2015/11/03/written-testimony-tsa-administrator-house-committee-oversight-and-government-reform,"November 3, 2015",Testimony
"Written testimony of S&T Under Secretary for a House Committee on Science, Space, and Technology hearing titled “A Review of Progress by the Department of Homeland Security, Science and Technology Directorate”",https://www.dhs.gov/news/2015/10/27/written-testimony-st-under-secretary-house-committee-science-space-and-technology,"October 27, 2015",Testimony
Written testimony of DNDO Director for a House Transportation and Infrastructure Subcommittee on Coast Guard and Maritime Transportation hearing titled “Prevention of and Response to the Arrival of a Dirty Bomb at a U.S. Port”,https://www.dhs.gov/news/2015/10/27/written-testimony-dndo-director-house-transportation-and-infrastructure,"October 27, 2015",Testimony
Written testimony of USCG for a House Transportation and Infrastructure Subcommittee on Coast Guard and Maritime Transportation hearing titled “Prevention of and Response to the Arrival of a Dirty Bomb at a U.S. Port”,https://www.dhs.gov/news/2015/10/27/written-testimony-uscg-house-transportation-and-infrastructure-subcommittee-coast,"October 27, 2015",Testimony
Written testimony of USCIS Director for a House Foreign Affairs Subcommittee on the Middle East and North Africa hearing titled “Examining the Syrian Humanitarian Crisis from the Ground (Part II)”,https://www.dhs.gov/news/2015/10/27/written-testimony-uscis-director-house-foreign-affairs-subcommittee-middle-east-and,"October 27, 2015",Testimony
Written testimony of CBP for a House Transportation and Infrastructure Subcommittee on Coast Guard and Maritime Transportation	hearing titled “Prevention of and Response to the Arrival of a Dirty Bomb at a U.S. Port”,https://www.dhs.gov/news/2015/10/27/written-testimony-cbp-house-transportation-and-infrastructure-subcommittee-coast,"October 27, 2015",Testimony
"Written testimony of TSA for a House Homeland Security Subcommittee on Transportation Security field hearing titled “Examining Critical Security Measures, Communications, and Response at our Nation’s Airports”",https://www.dhs.gov/news/2015/10/26/written-testimony-tsa-house-homeland-security-subcommittee-transportation-security,"October 26, 2015",Testimony
"Written testimony of FEMA Administrator for a House Homeland Security Subcommittee on Emergency Preparedness, Response, and Communications hearing titled “Ready and Resilient?: Examining Federal Emergency Preparedness and Response Capabilities”",https://www.dhs.gov/news/2015/10/22/written-testimony-fema-administrator-house-homeland-security-subcommittee-emergency,"October 22, 2015",Testimony
Written testimony of CBP for a Senate Homeland Security and Governmental Affairs Subcommittee on Regulatory Affairs and Federal Management hearing titled “Improving Pay Flexibilities in the Federal Workforce”,https://www.dhs.gov/news/2015/10/22/written-testimony-cbp-senate-homeland-security-and-governmental-affairs,"October 22, 2015",Testimony
Written testimony of PLCY for a House Oversight and Government Reform Subcommittee on Information Technology hearing titled “Examining Law Enforcement Use of Cell Phone Tracking Devices”,https://www.dhs.gov/news/2015/10/21/written-testimony-plcy-house-oversight-and-government-reform-subcommittee,"October 21, 2015",Testimony
Written testimony of DHS Secretary for a House Committee on Homeland Security hearing titled “Worldwide Threats and Homeland Security Challenges”,https://www.dhs.gov/news/2015/10/21/written-testimony-dhs-secretary-house-committee-homeland-security-hearing-titled,"October 21, 2015",Testimony
Written testimony of USCG for a House Homeland Security Subcommittee on Border and Maritime Security hearing titled “Protecting Maritime Facilities in the 21st Century: Are Our Nation’s Ports at Risk for a Cyber-Attack?”,https://www.dhs.gov/news/2015/10/08/written-testimony-uscg-house-homeland-security-subcommittee-border-and-maritime,"October 8, 2015",Testimony
Written testimony of TSA Administrator for a House Homeland Security Subcommittee on Transportation Security hearing titled “Reform and Improvement: Assessing the Path Forward for the Transportation Security Administration”,https://www.dhs.gov/news/2015/10/08/written-testimony-tsa-administrator-house-homeland-security-subcommittee,"October 8, 2015",Testimony
"Written testimony of FLETC Director for a Senate Foreign Relations Subcommittee on State Department and USAID Management,... hearing titled “Ensuring Oversight: Vetting Decisions for State Department’s New Diplomatic Security Training Facility”",https://www.dhs.gov/news/2015/10/08/written-testimony-fletc-director-senate-foreign-relations-subcommittee-state,"October 8, 2015",Testimony
Written testimony of DHS Secretary Jeh Johnson for a Senate Committee on Homeland Security and Governmental Affairs hearing titled “Threats to the Homeland”,https://www.dhs.gov/news/2015/10/08/written-testimony-dhs-secretary-jeh-johnson-senate-committee-homeland-security-and,"October 8, 2015",Testimony
"Written testimony of NPPD Under Secretary for a House Homeland Security Subcommittee on Cybersecurity, Infrastructure Protection, and Security Technologies hearing titled “Examining the Mission, Structure, and Reorganization Effort of the NPPD”",https://www.dhs.gov/news/2015/10/07/written-testimony-nppd-under-secretary-house-homeland-security-subcommittee,"October 7, 2015",Testimony
Written testimony of USCIS for a Senate Judiciary Subcommittee on Immigration and the National Interest hearing titled “Oversight of the Administration’s FY 2016 Refugee Resettlement Program: Fiscal and Security Implications”,https://www.dhs.gov/news/2015/10/01/written-testimony-uscis-senate-judiciary-subcommittee-immigration-and-national,"October 1, 2015",Testimony
Written testimony of TSA Administrator for a Senate Appropriations Subcommittee on Homeland Security hearing titled “Hearing to Discuss the Transportation Security Administration’s Efforts to Address Inspector General Findings”,https://www.dhs.gov/news/2015/09/29/written-testimony-tsa-administrator-senate-appropriations-subcommittee-homeland,"September 29, 2015",Testimony
Written testimony of TSA Assistant Administrator for the Office of Law Enforcement and Director of the Federal Air Marshal Service Roderick Allison for a House Committee on Oversight and Government Reform hearing titled “Federal Air Marshal Service: Overs,https://www.dhs.gov/news/2015/09/17/written-testimony-tsa-assistant-administrator-office-law-enforcement-and-director,"September 17, 2015",Testimony
"Written testimony of TSA for a House Homeland Security Subcommittees on Transportation Security, and on Counterterrorism and Intelligence hearing titled “Safeguarding Our Nation's Surface Transportation Systems Against Evolving Terrorist Threats”",https://www.dhs.gov/news/2015/09/17/written-testimony-tsa-house-homeland-security-subcommittees-transportation-security,"September 17, 2015",Testimony
Written testimony of TSA Administrator for a House Committee on Homeland Security hearing titled “Aviation Security Challenges: Is TSA ready for the threats of today?”,https://www.dhs.gov/news/2015/07/29/written-testimony-tsa-administrator-house-committee-homeland-security-hearing,"July 29, 2015",Testimony
"Written testimony of USCG for a House Transportation & Infrastructure Subcommittee on Coast Guard & Maritime Transportation hearing titled “The Federal Radionavigation Plan, the Foreign Spill Protection Act, and the National Icebreaker Fund Act of 2015”",https://www.dhs.gov/news/2015/07/28/written-testimony-uscg-house-transportation-infrastructure-subcommittee-coast-guard,"July 28, 2015",Testimony
Written testimony of FLETC Director for a Senate Committee on Homeland Security and Governmental Affairs hearing titled “Avoiding Duplication: An Examination of the State Department's Proposal to Construct a New Diplomatic Security Training Facility”,https://www.dhs.gov/news/2015/07/28/written-testimony-fletc-director-senate-committee-homeland-security-and,"July 28, 2015",Testimony
Written testimony of ICE Director for a Senate Committee on the Judiciary hearing titled “Oversight of the Administration’s Misdirected Immigration Enforcement Policies: Examining the Impact of Public Safety and Honoring the Victims”,https://www.dhs.gov/news/2015/07/21/written-testimony-ice-director-senate-committee-judiciary-hearing-titled-oversight,"July 21, 2015",Testimony
Written testimony of USCIS Director León Rodríguez for a Senate Committee on the Judiciary hearing titled “Oversight of the Administration’s Misdirected Immigration Enforcement Policies: Examining the Impact of Public Safety and Honoring the Victims”,https://www.dhs.gov/news/2015/07/21/written-testimony-uscis-director-leon-rodriguez-senate-committee-judiciary-hearing,"July 21, 2015",Testimony
Written testimony of TSA for a House Homeland Security Subcommittee on Transportation Security hearing titled “Examining the Federal Air Marshal Service and Its Readiness to Meet the Evolving Threat”,https://www.dhs.gov/news/2015/07/16/written-testimony-tsa-house-homeland-security-subcommittee-transportation-security,"July 16, 2015",Testimony
Written testimony of USCG for a Senate Committee on Homeland Security and Governmental Affairs hearing titled “Securing the Border: Understanding Threats and Strategies for the Maritime Border”,https://www.dhs.gov/news/2015/07/15/written-testimony-uscg-senate-committee-homeland-security-and-governmental-affairs,"July 15, 2015",Testimony
Written testimony of CBP for a Senate Committee on Homeland Security and Governmental Affairs hearing titled “Securing the Border: Understanding Threats and Strategies for the Maritime Border”,https://www.dhs.gov/news/2015/07/15/written-testimony-cbp-senate-committee-homeland-security-and-governmental-affairs,"July 15, 2015",Testimony
Written testimony of ICE for a Senate Committee on Homeland Security and Governmental Affairs hearing titled “Securing the Border: Understanding Threats and Strategies for the Maritime Border”,https://www.dhs.gov/news/2015/07/15/written-testimony-ice-senate-committee-homeland-security-and-governmental-affairs,"July 15, 2015",Testimony
"Written testimony of S&T Under Secretary, OHA Assistant Secretary, and DNDO Director for a House Committee on Homeland Security joint subcommittee hearing titled “Weapons of Mass Destruction: Bolstering DHS to Combat Persistent Threats to America”",https://www.dhs.gov/news/2015/07/14/written-testimony-st-under-secretary-oha-assistant-secretary-and-dndo-director,"July 14, 2015",Testimony
Written testimony of CBP for a House Homeland Security Subcommittee on Border and Maritime Security hearing titled “Securing the Maritime Border:  The Future of CBP Air and Marine”,https://www.dhs.gov/news/2015/07/14/written-testimony-cbp-house-homeland-security-subcommittee-border-and-maritime,"July 14, 2015",Testimony
Written testimony of DHS Secretary Johnson for a House Committee on the Judiciary hearing titled “Oversight of the U.S. Department of Homeland Security”,https://www.dhs.gov/news/2015/07/14/written-testimony-dhs-secretary-johnson-house-committee-judiciary-hearing-titled,"July 14, 2015",Testimony
Written testimony of NPPD for a House Homeland Security Subcommittee on Oversight and Management Efficiency hearing titled “Examining DHS’ Misplaced Focus on Climate Change”,https://www.dhs.gov/news/2015/07/08/written-testimony-nppd-house-homeland-security-subcommittee-oversight-and,"July 8, 2015",Testimony
Written testimony of FEMA for a House Homeland Security Subcommittee on Oversight and Management Efficiency hearing titled “Examining DHS’ Misplaced Focus on Climate Change”,https://www.dhs.gov/news/2015/07/08/written-testimony-fema-house-homeland-security-subcommittee-oversight-and,"July 8, 2015",Testimony
Written testimony of PLCY for a House Homeland Security Subcommittee on Oversight and Management Efficiency hearing titled “Examining DHS’ Misplaced Focus on Climate Change”,https://www.dhs.gov/news/2015/07/08/written-testimony-plcy-house-homeland-security-subcommittee-oversight-and,"July 8, 2015",Testimony
Written testimony of USCIS for a Senate Committee on Homeland Security and Governmental Affairs hearing titled “The 2014 Humanitarian Crisis at our Border: A Review of the Government’s Response to Unaccompanied Minors One Year Later”,https://www.dhs.gov/news/2015/07/07/written-testimony-uscis-senate-committee-homeland-security-and-governmental-affairs,"July 7, 2015",Testimony
Written testimony of ICE for a Senate Committee on Homeland Security and Governmental Affairs hearing titled “The 2014 Humanitarian Crisis at our Border: A Review of the Government’s Response to Unaccompanied Minors One Year Later”,https://www.dhs.gov/news/2015/07/07/written-testimony-ice-senate-committee-homeland-security-and-governmental-affairs,"July 7, 2015",Testimony
Written testimony of NPPD for a Senate Committee on Homeland Security and Governmental Affairs hearing titled “Under Attack: Federal Cybersecurity and the OPM Data Breach”,https://www.dhs.gov/news/2015/06/25/written-testimony-nppd-senate-committee-homeland-security-and-governmental-affairs,"June 25, 2015",Testimony
"Written testimony of NPPD for a House Homeland Security Subcommittee on Cybersecurity, Infrastructure Protection, and Security Technologies hearing titled  “DHS’ Efforts to Secure .Gov”",https://www.dhs.gov/news/2015/06/24/written-testimony-nppd-house-homeland-security-subcommittee-cybersecurity,"June 24, 2015",Testimony
"Written testimony of ICE Director for a House Oversight and Government Reform Subcommittee on National Security and Subcommittee on Health Care, Benefits and Administrative Rules hearing titled “A Review of the President’s Executive Actions on Immigration",https://www.dhs.gov/news/2015/06/17/written-testimony-ice-director-house-oversight-and-government-reform-subcommittee,"June 17, 2015",Testimony
"Written testimony of USCIS Director for a House Oversight and Government Reform Subcommittee on National Security and Subcommittee on Health Care, Benefits and Administrative Rules Hearing “A Review of the President’s Executive Actions on Immigration",https://www.dhs.gov/news/2015/06/17/written-testimony-uscis-director-house-oversight-and-government-reform-subcommittee,"June 17, 2015",Testimony
Written testimony of NPPD for a House Committee on Oversight and Government Reform hearing titled “OPM: Data Breach”,https://www.dhs.gov/news/2015/06/16/written-testimony-nppd-house-committee-oversight-and-government-reform-hearing,"June 16, 2015",Testimony
Written testimony of USCG for a House Transportation and Infrastructure Subcommittee on Coast Guard and Maritime Transportation hearing titled “Western Hemisphere Drug Interdiction Efforts”,https://www.dhs.gov/news/2015/06/16/written-testimony-uscg-house-transportation-and-infrastructure-subcommittee-coast,"June 16, 2015",Testimony
"Written testimony of FEMA for a House Homeland Security Subcommittee on Emergency Preparedness, Response, and Communications hearing titled “Defense Support of Civil Authorities: A Vital Resource in the Nation’s Homeland Security Missions”",https://www.dhs.gov/news/2015/06/10/written-testimony-fema-house-homeland-security-subcommittee-emergency-preparedness,"June 10, 2015",Testimony
"Written testimony of I&A Under Secretary for a House Committee on Homeland Security hearing titled “Terrorism Gone Viral: The Attack in Garland, Texas and Beyond”",https://www.dhs.gov/news/2015/06/03/written-testimony-ia-under-secretary-house-committee-homeland-security-hearing,"June 3, 2015",Testimony
Written testimony of PRIV Chief Privacy Officer for a House Committee on Oversight and Government Reform hearing titled  “Ensuring Agency Compliance with the Freedom of Information Act (FOIA)”,https://www.dhs.gov/news/2015/06/03/written-testimony-priv-chief-privacy-officer-house-committee-oversight-and,"June 3, 2015",Testimony
Written testimony of FEMA for a House Financial Services Subcommittee on Housing and Insurance hearing titled “The National Flood Insurance Program: Oversight of Superstorm Sandy Claims”,https://www.dhs.gov/news/2015/06/02/written-testimony-fema-house-financial-services-subcommittee-housing-and-insurance,"June 2, 2015",Testimony
Written testimony of CBP for a House Homeland Security Subcommittee on Border and Maritime Security hearing titled “The Outer Ring of Border Security: DHS’s International Security Programs”,https://www.dhs.gov/news/2015/06/02/written-testimony-cbp-house-homeland-security-subcommittee-border-and-maritime,"June 2, 2015",Testimony
Written testimony of ICE for a House Homeland Security Subcommittee on Border and Maritime Security hearing titled “The Outer Ring of Border Security: DHS’s International Security Programs”,https://www.dhs.gov/news/2015/06/02/written-testimony-ice-house-homeland-security-subcommittee-border-and-maritime,"June 2, 2015",Testimony
Written testimony of PLCY for a House Homeland Security Subcommittee on Border and Maritime Security hearing titled “The Outer Ring of Border Security: DHS’s International Security Programs”,https://www.dhs.gov/news/2015/06/02/written-testimony-plcy-house-homeland-security-subcommittee-border-and-maritime,"June 2, 2015",Testimony
"Written testimony of FEMA for a House Transportation and Infrastructure Subcommittee on Economic Development, Public Buildings, and Emergency Management hearing titled “Pacific Northwest Seismic Hazards: Planning and Preparing for the Next Disaster”",https://www.dhs.gov/news/2015/05/19/written-testimony-fema-house-transportation-and-infrastructure-subcommittee,"May 19, 2015",Testimony
"Written testimony of S&T for a Senate Committee on Homeland Security and Governmental Affairs for a hearing titled “Securing the Border: Fencing, Infrastructure, and Technology Force Multipliers”",https://www.dhs.gov/news/2015/05/13/written-testimony-st-senate-committee-homeland-security-and-governmental-affairs,"May 13, 2015",Testimony
TSA statement for the record for a House Committee on Oversight and Government Reform hearing titled  “Transportation Security: Are Our Airports Safe?”,https://www.dhs.gov/news/2015/05/13/tsa-statement-record-house-committee-oversight-and-government-reform-hearing-titled,"May 13, 2015",Testimony
"Written testimony of TSA Acting Administrator for a House Homeland Security Subcommittee on Transportation Security hearing titled “A Review of Access Control Measures at Our Nation's Airports,   Part II”",https://www.dhs.gov/news/2015/04/30/written-testimony-tsa-acting-administrator-house-homeland-security-subcommittee,"April 30, 2015",Testimony
Written testimony of PLCY for a House Foreign Affairs Subcommittee on Western Hemisphere hearing titled “Migration Crisis: Oversight of the Administration’s Proposed $1 Billion Request for Central America”,https://www.dhs.gov/news/2015/04/30/written-testimony-plcy-house-foreign-affairs-subcommittee-western-hemisphere,"April 30, 2015",Testimony
Written testimony of DHS Deputy Secretary Alejandro Mayorkas for a House Committee on Homeland Security hearing titled “Allegations of Special Access and Political Influence at the Department of Homeland Security”,https://www.dhs.gov/news/2015/04/30/written-testimony-dhs-deputy-secretary-alejandro-mayorkas-house-committee-homeland,"April 30, 2015",Testimony
Written testimony of DHS Secretary Jeh Johnson for a Senate Appropriations Subcommittee on Homeland Security hearing to review the Fiscal Year 2016 funding request and budget justification for the U.S. Department of Homeland Security,https://www.dhs.gov/news/2015/04/29/written-testimony-dhs-secretary-jeh-johnson-senate-appropriations-subcommittee,"April 29, 2015",Testimony
Written testimony of DHS Secretary Jeh Johnson for a Senate Committee on Homeland Security and Governmental Affairs hearing titled “The Homeland Security Department’s Budget Submission for Fiscal Year 2016”,https://www.dhs.gov/news/2015/04/29/written-testimony-dhs-secretary-jeh-johnson-senate-committee-homeland-security-and,"April 29, 2015",Testimony
"Written testimony of DHS Secretary Jeh Johnson for a Senate Committee on the Judiciary hearing titled “Oversight of the Department of Homeland Security” (April 28, 2015)",https://www.dhs.gov/news/2015/04/28/written-testimony-dhs-secretary-jeh-johnson-senate-committee-judiciary-hearing,"April 28, 2015",Testimony
"Written testimony of USCG Commandant for a Senate Commerce, Science and Transportation Subcommittee on Oceans, Atmosphere, Fisheries and Coast Guard hearing titled “Staying Afloat: Examining the Resources and Priorities of the U.S. Coast Guard”",https://www.dhs.gov/news/2015/04/28/written-testimony-uscg-commandant-senate-commerce-science-and-transportation,"April 28, 2015",Testimony
Written testimony of USCIS for a Senate Judiciary Subcommittee on Immigration and The National Interest hearing titled “Eroding the Law and Diverting Taxpayer Resources: An Examination of the Administration's Central American Minors Refugee/Parole Program,https://www.dhs.gov/news/2015/04/23/written-testimony-uscis-senate-judiciary-subcommittee-immigration-and-national,"April 23, 2015",Testimony
Written testimony of FEMA Administrator for a House Appropriations Subcommittee on Homeland Security hearing to review FEMA’s Fiscal Year 2016 funding request and budget justification,https://www.dhs.gov/news/2015/04/23/written-testimony-fema-administrator-house-appropriations-subcommittee-homeland,"April 23, 2015",Testimony
USCG statement for the record for a House Committee on Natural Resources hearing titled “Innovations in Safety Since the 2010 Macondo Incident.”,https://www.dhs.gov/news/2015/04/22/uscg-statement-record-house-committee-natural-resources-hearing-titled-innovations,"April 22, 2015",Testimony
Written testimony of FEMA Administrator for a Senate Appropriations Subcommittee on Homeland Security hearing to review FEMA’s Fiscal Year 2016 funding request and budget justification,https://www.dhs.gov/news/2015/04/22/written-testimony-fema-administrator-senate-appropriations-subcommittee-homeland,"April 22, 2015",Testimony
Written testimony of ICE for a Senate Committee on Homeland Security and Governmental Affairs hearing titled “Securing the Border: Understanding Threats and Strategies for the Northern Border”,https://www.dhs.gov/news/2015/04/22/written-testimony-ice-senate-committee-homeland-security-and-governmental-affairs,"April 22, 2015",Testimony
Written testimony of MGMT for a House Oversight and Government Reform Subcommittee on Government Operations hearing titled “The Worst Places to Work in the Federal Government”,https://www.dhs.gov/news/2015/04/16/written-testimony-mgmt-house-oversight-and-government-reform-subcommittee,"April 16, 2015",Testimony
"Written testimony of USSS for a House Judiciary Subcommittee on Crime, Terrorism and Homeland Security hearing titled “Analyzing Misconduct in the Federal Law Enforcement”",https://www.dhs.gov/news/2015/04/15/written-testimony-usss-house-judiciary-subcommittee-crime-terrorism-and-homeland,"April 15, 2015",Testimony
Written testimony of USCG for a House Transportation and Infrastructure Subcommittee on Coast Guard and Maritime Transportation hearing titled “An Overview of the U.S. Coast Guard’s Missions”,https://www.dhs.gov/news/2015/04/15/written-testimony-uscg-house-transportation-and-infrastructure-subcommittee-coast,"April 15, 2015",Testimony
