title,link,date,type
Keeping a Healthy Home,https://www.dhs.gov/employee-resources/news/2021/07/22/keeping-healthy-home,"July 22, 2021",Blog
Feds Feed Families,https://www.dhs.gov/employee-resources/news/2021/07/20/feds-feed-families,"July 20, 2021",Blog
News Release: DHS Award to Develop Handheld Screening Device,https://www.dhs.gov/science-and-technology/news/2021/07/19/news-release-dhs-award-develop-handheld-screening-device,"July 19, 2021",Press Releases
Feature Article: As Drone Popularity and Potential Risk Soars S&T Prepares,https://www.dhs.gov/science-and-technology/news/2021/07/16/feature-article-drone-popularity-and-potential-risk-soars-st-prepares,"July 16, 2021",Press Releases
News Release: S&T Seeks Blast Resistant Trash Receptacles for Market Survey Analysis,https://www.dhs.gov/science-and-technology/news/2021/07/16/news-release-st-seeks-blast-resistant-trash-receptacles-market-survey-analysis,"July 16, 2021",Press Releases
News Release: S&T Partnership Brings NICS Response to a Wider Response Community,https://www.dhs.gov/science-and-technology/news/2021/07/15/news-release-st-partnership-brings-nics-response-wider-response-community,"July 15, 2021",Press Releases
Sleep Tips,https://www.dhs.gov/employee-resources/news/2021/07/08/sleep-tips,"July 8, 2021",Blog
News Release: DHS Announces Results of 2020 Privacy Technology Demonstration,https://www.dhs.gov/science-and-technology/news/2021/07/08/news-release-dhs-announces-results-2020-privacy-technology-demonstration,"July 8, 2021",Press Releases
Planning for College,https://www.dhs.gov/employee-resources/news/2021/07/07/planning-college,"July 7, 2021",Blog
News Release: DHS Awards to Secure NG9-1-1 Multimedia Content,https://www.dhs.gov/science-and-technology/news/2021/07/07/news-release-dhs-awards-secure-ng9-1-1-multimedia-content,"July 7, 2021",Press Releases
News Release: DHS Seeks Technology Information from Other Federal Agencies SBIR/STTRs Initiatives,https://www.dhs.gov/science-and-technology/news/2021/07/02/news-release-dhs-seeks-technology-information-other-federal-agencies-sbirsttrs,"July 2, 2021",Press Releases
News Release: S&T Transitions Resilient PNT Conformance Framework,https://www.dhs.gov/science-and-technology/news/2021/06/30/news-release-st-transitions-resilient-pnt-conformance-framework,"June 30, 2021",Press Releases
Summer Food Safety,https://www.dhs.gov/employee-resources/news/2021/06/29/summer-food-safety,"June 29, 2021",Blog
Feature Article: NYC Subway Sensors Could Warn Early for Chem/Bio Threats,https://www.dhs.gov/science-and-technology/news/2021/06/29/feature-article-nyc-subway-sensors-could-warn-early-chembio-threats,"June 29, 2021",Press Releases
Forging Cybersecurity Bonds through Global Fellowship,https://www.dhs.gov/science-and-technology/news/2021/06/28/forging-cybersecurity-bonds-through-global-fellowship,"June 28, 2021",Blog
News Release: NIST Awards to Commercialize Interoperable Public Safety Communications System,https://www.dhs.gov/science-and-technology/news/2021/06/28/news-release-nist-awards-commercialize-interoperable-public-safety-communications,"June 28, 2021",Press Releases
News Release: S&T Funds Florida Small Business to Develop COVID-19 Disinfectant,https://www.dhs.gov/science-and-technology/news/2021/06/25/news-release-st-funds-florida-small-business-develop-covid-19-disinfectant,"June 25, 2021",Press Releases
Technology Support for Seniors,https://www.dhs.gov/employee-resources/news/2021/06/24/technology-support-seniors,"June 24, 2021",Blog
Feature Article: A Virus or Bacteria? New Tech Rapidly Tests for COVID-19 & More,https://www.dhs.gov/science-and-technology/news/2021/06/24/feature-article-virus-or-bacteria-new-tech-rapidly-tests-covid-19-more,"June 24, 2021",Press Releases
Brain Health as You Age,https://www.dhs.gov/employee-resources/news/2021/06/22/brain-health-you-age,"June 22, 2021",Blog
News Release: S&T Hosts Virtual Whole-of-Government R&D Showcase,https://www.dhs.gov/science-and-technology/news/2021/06/21/news-release-st-hosts-virtual-whole-government-rd-showcase,"June 21, 2021",Press Releases
Unifying Research to Work for You,https://www.dhs.gov/science-and-technology/news/2021/06/21/unifying-research-work-you,"June 21, 2021",Blog
How Your Employee Assistance Program Supports Parents,https://www.dhs.gov/employee-resources/news/2021/06/17/how-your-employee-assistance-program-supports-parents,"June 17, 2021",Blog
CHCO Blog - Clarity Within,https://www.dhs.gov/employee-resources/news/2021/06/16/chco-blog-clarity-within,"June 16, 2021",Blog
News Release: New S&T Funding Opportunities Available for First Responder Technology R&D,https://www.dhs.gov/science-and-technology/news/2021/06/15/news-release-new-st-funding-opportunities-available-first-responder-technology-rd,"June 15, 2021",Press Releases
June is Men's Health Month,https://www.dhs.gov/employee-resources/news/2021/06/15/june-mens-health-month,"June 15, 2021",Blog
News Release: S&T Successfully Evaluates Wildfire Sensors,https://www.dhs.gov/science-and-technology/news/2021/06/10/news-release-st-successfully-evaluates-wildfire-sensors,"June 10, 2021",Press Releases
Improving Posture,https://www.dhs.gov/employee-resources/news/2021/06/10/improving-posture,"June 10, 2021",Blog
Feature Article: Evaluating Border Security Technologies in the Plains of North Dakota,https://www.dhs.gov/science-and-technology/news/2021/06/10/feature-article-evaluating-border-security-technologies-plains-north-dakota,"June 10, 2021",Press Releases
CHCO Blog - What Public Service Means to Me,https://www.dhs.gov/employee-resources/news/2021/06/08/chco-blog-what-public-service-means-me,"June 8, 2021",Blog
Post-Traumatic Stress Disorder Awareness Month,https://www.dhs.gov/employee-resources/news/2021/06/08/post-traumatic-stress-disorder-awareness-month,"June 8, 2021",Blog
Feature Article: Hands-Free Comms Tech Breaks Through the Noise,https://www.dhs.gov/science-and-technology/news/2021/06/03/feature-article-hands-free-comms-tech-breaks-through-noise,"June 3, 2021",Press Releases
Flexible Spending Accounts Special Enrollment Period,https://www.dhs.gov/employee-resources/news/2021/06/03/flexible-spending-accounts-special-enrollment-period,"June 3, 2021",Blog
Summer Boating Safety,https://www.dhs.gov/employee-resources/news/2021/06/03/summer-boating-safety,"June 3, 2021",Blog
Alzheimer's Awareness,https://www.dhs.gov/employee-resources/news/2021/06/01/alzheimers-awareness,"June 1, 2021",Blog
CHCO Blog - Heroes Among Us,https://www.dhs.gov/employee-resources/news/2021/06/01/chco-blog-heroes-among-us,"June 1, 2021",Blog
Sun Safety,https://www.dhs.gov/employee-resources/news/2021/05/27/sun-safety,"May 27, 2021",Blog
News Release: DHS Awards to U.S. Small Business for Homeland Security R&D,https://www.dhs.gov/science-and-technology/news/2021/05/26/news-release-dhs-awards-us-small-business-homeland-security-rd,"May 26, 2021",Press Releases
Feature Article: How Investments in International Relationships Pay Off,https://www.dhs.gov/science-and-technology/news/2021/05/25/feature-article-how-investments-international-relationships-pay,"May 25, 2021",Press Releases
News Release: DHS Partners with South Korea for Aviation Security,https://www.dhs.gov/science-and-technology/news/2021/05/21/news-release-dhs-partners-south-korea-aviation-security,"May 21, 2021",Press Releases
Practicing Mindfulness,https://www.dhs.gov/employee-resources/news/2021/05/20/practicing-mindfulness,"May 20, 2021",Blog
News Release: DHS S&T Calls for Submissions to Biometric Tech Rally,https://www.dhs.gov/science-and-technology/news/2021/05/19/news-release-dhs-st-calls-submissions-biometric-tech-rally,"May 19, 2021",Press Releases
News Release DHS & USCG to Hold Virtual Industry Day,https://www.dhs.gov/science-and-technology/news/2021/05/18/news-release-dhs-uscg-hold-virtual-industry-day,"May 18, 2021",Press Releases
Oral Testimony of Secretary of Homeland Security Alejandro N. Mayorkas before the U.S. Senate Committee on Homeland Security & Governmental Affairs,https://www.dhs.gov/news/2021/05/13/oral-testimony-secretary-homeland-security-alejandro-n-mayorkas-us-senate-committee,"May 13, 2021",Testimony
Summer Camp Resources,https://www.dhs.gov/employee-resources/news/2021/05/13/summer-camp-resources,"May 13, 2021",Blog
Feature Article: Protecting Food from the Farm to Our Plates,https://www.dhs.gov/science-and-technology/news/2021/05/13/feature-article-protecting-food-farm-our-plates,"May 13, 2021",Press Releases
Oral Testimony of Secretary of Homeland Security Alejandro N. Mayorkas before the Senate Appropriations Committee,https://www.dhs.gov/news/2021/05/12/oral-testimony-secretary-homeland-security-alejandro-n-mayorkas-senate,"May 12, 2021",Testimony
Honoring Our Law Enforcement Colleagues During National Police Week,https://www.dhs.gov/science-and-technology/news/2021/05/10/honoring-our-law-enforcement-colleagues-during-national-police-week,"May 10, 2021",Blog
Military Spouse Appreciation Day,https://www.dhs.gov/employee-resources/news/2021/05/06/military-spouse-appreciation-day,"May 6, 2021",Blog
Family Fitness,https://www.dhs.gov/employee-resources/news/2021/05/05/family-fitness,"May 5, 2021",Blog
May the Fourth (and S&T’s ‘Force’) Be with Our Firefighters,https://www.dhs.gov/science-and-technology/news/2021/05/04/may-fourth-and-sts-force-be-our-firefighters,"May 4, 2021",Blog
April is Financial Literacy Month: Controlling Debt,https://www.dhs.gov/employee-resources/news/2021/04/29/april-financial-literacy-month-controlling-debt,"April 29, 2021",Blog
News Release: DHS-Funded Security Technology Licensed for Commercialization,https://www.dhs.gov/science-and-technology/news/2021/04/27/news-release-dhs-funded-security-technology-licensed-commercialization,"April 27, 2021",Press Releases
News Release: DHS COE Releases Report on Cross-Border E-Commerce,https://www.dhs.gov/science-and-technology/news/2021/04/23/news-release-dhs-coe-releases-report-cross-border-e-commerce,"April 23, 2021",Press Releases
News Release: Veteran-Owned Start-Up to Develop New COVID-19 Screening Method,https://www.dhs.gov/science-and-technology/news/2021/04/22/news-release-veteran-owned-start-develop-new-covid-19-screening-method,"April 22, 2021",Press Releases
Financial Caregiving Basics,https://www.dhs.gov/employee-resources/news/2021/04/22/financial-caregiving-basics,"April 22, 2021",Blog
National Volunteer Week,https://www.dhs.gov/employee-resources/news/2021/04/20/national-volunteer-week,"April 20, 2021",Blog
Feature Article: New Tech Makes Detecting Airborne Ebola Virus Possible,https://www.dhs.gov/science-and-technology/news/2021/04/20/feature-article-new-tech-makes-detecting-airborne-ebola-virus-possible,"April 20, 2021",Press Releases
REAL ID - Minimum Standards for Driver’s Licenses,https://www.dhs.gov/real-id/news/2021/04/19/real-id-minimum-standards-drivers-licenses,"April 19, 2021",Press Releases
Additional Resources for Stress Management,https://www.dhs.gov/employee-resources/news/2021/04/13/additional-resources-stress-management,"April 13, 2021",Blog
CHCO Blog - Spark The Light Within Your Soul,https://www.dhs.gov/employee-resources/news/2021/04/13/chco-blog-spark-light-within-your-soul,"April 13, 2021",Blog
Feature Article: New Research Improves Vehicle Inspections at Security Checkpoints,https://www.dhs.gov/science-and-technology/news/2021/04/13/feature-article-new-research-improves-vehicle-inspections-security-checkpoints,"April 13, 2021",Press Releases
Arming Responders with Critical Interoperable Communications Capabilities,https://www.dhs.gov/science-and-technology/news/2021/04/12/arming-responders-critical-interoperable-communications-capabilities,"April 12, 2021",Blog
News Release: DHS Partners with DWX to Advance Homeland Security Solutions,https://www.dhs.gov/science-and-technology/news/2021/04/09/news-release-dhs-partners-dwx-advance-homeland-security-solutions,"April 9, 2021",Press Releases
CHCO Blog - Changing Your Perception,https://www.dhs.gov/employee-resources/news/2021/04/08/chco-blog-changing-your-perception,"April 8, 2021",Blog
News Release: S&T Expands Pilot of Cybersecurity Tech for Emergency Communications Centers,https://www.dhs.gov/science-and-technology/news/2021/04/08/news-release-st-expands-pilot-cybersecurity-tech-emergency-communications-centers,"April 8, 2021",Press Releases
Help Prevent Child Abuse and Neglect,https://www.dhs.gov/employee-resources/news/2021/04/07/help-prevent-child-abuse-and-neglect,"April 7, 2021",Blog
Feature Article: Pointing to the Future of Lifesaving Firefighting Technology,https://www.dhs.gov/science-and-technology/news/2021/04/06/feature-article-pointing-future-lifesaving-firefighting-technology,"April 6, 2021",Press Releases
News Release: DHS S&T SVIP Awards Funding to Monitor Current and Future Biological Threats,https://www.dhs.gov/science-and-technology/news/2021/04/05/news-release-dhs-st-svip-awards-funding-monitor-current-and-future-biological,"April 5, 2021",Press Releases
CHCO Blog - Change From Within,https://www.dhs.gov/employee-resources/news/2021/04/01/chco-blog-change-within,"April 1, 2021",Blog
Persevere Under Pressure,https://www.dhs.gov/employee-resources/news/2021/03/30/persevere-under-pressure,"March 30, 2021",Blog
Communicating with Your Teen,https://www.dhs.gov/employee-resources/news/2021/03/24/communicating-your-teen,"March 24, 2021",Blog
"Feature Article: S&T Partnership Enhances Public Safety Spectrum Efficiency, Improves Interoperability",https://www.dhs.gov/science-and-technology/news/2021/03/23/feature-article-st-partnership-enhances-public-safety-spectrum-efficiency-improves,"March 23, 2021",Press Releases
Keep an Eye on Your Vision Health,https://www.dhs.gov/employee-resources/news/2021/03/18/keep-eye-your-vision-health,"March 18, 2021",Blog
Feature Article: R&D Collaboration Leads to Award-Winning Chemical Weapons Detection Tech,https://www.dhs.gov/science-and-technology/news/2021/03/18/feature-article-rd-collaboration-leads-award-winning-chemical-weapons-detection,"March 18, 2021",Press Releases
Home Maintenance,https://www.dhs.gov/employee-resources/news/2021/03/16/home-maintenance,"March 16, 2021",Blog
News Release: Grand-Prize Winner Announced in Digital Wallets Challenge,https://www.dhs.gov/science-and-technology/news/2021/03/15/news-release-grand-prize-winner-announced-digital-wallets-challenge,"March 15, 2021",Press Releases
News Release: DHS Partners with Harvard University to Support Blue Campaign,https://www.dhs.gov/science-and-technology/news/2021/03/12/news-release-dhs-partners-harvard-university-support-blue-campaign,"March 12, 2021",Press Releases
Importance of Sleep,https://www.dhs.gov/employee-resources/news/2021/03/11/importance-sleep,"March 11, 2021",Blog
CHCO Blog - Reflection and Balance,https://www.dhs.gov/employee-resources/news/2021/03/10/chco-blog-reflection-and-balance,"March 10, 2021",Blog
News Release: DHS Awards in Scientific Leadership Grants to Five Minority Serving Institutions,https://www.dhs.gov/science-and-technology/news/2021/03/10/news-release-dhs-awards-scientific-leadership-grants-five-minority-serving,"March 10, 2021",Press Releases
News Release: DHS S&T Offers New Funding Opportunities Through LRBAA,https://www.dhs.gov/science-and-technology/news/2021/03/09/news-release-dhs-st-offers-new-funding-opportunities-through-lrbaa,"March 9, 2021",Press Releases
Colorectal Cancer Awareness,https://www.dhs.gov/employee-resources/news/2021/03/09/colorectal-cancer-awareness,"March 9, 2021",Blog
News Release: DHS Announces Two R&D Projects to Enhance Mobile Network Traffic Security,https://www.dhs.gov/science-and-technology/news/2021/03/08/news-release-dhs-announces-two-rd-projects-enhance-mobile-network-traffic-security,"March 8, 2021",Press Releases
News Release: QuickRoute Navigation App Now Available for First Responders,https://www.dhs.gov/science-and-technology/news/2021/03/05/news-release-quickroute-navigation-app-now-available-first-responders,"March 5, 2021",Press Releases
Feature Article: S&T Past Research Informs Current and Future Pandemic Response,https://www.dhs.gov/science-and-technology/news/2021/03/04/feature-article-st-past-research-informs-current-and-future-pandemic-response,"March 4, 2021",Press Releases
News Release: S&T Awards Phase 1 Funding for Maritime Object Tracking Technology,https://www.dhs.gov/science-and-technology/news/2021/03/03/news-release-st-awards-phase-1-funding-maritime-object-tracking-technology,"March 3, 2021",Press Releases
Feature Article: Leveraging Partnerships to De-escalate Conflict in Law Enforcement Encounters,https://www.dhs.gov/science-and-technology/news/2021/03/02/feature-article-leveraging-partnerships-de-escalate-conflict-law-enforcement,"March 2, 2021",Press Releases
News Release: DHS S&T Awards Funding to Design Video Analytics for TSA Checkpoints,https://www.dhs.gov/science-and-technology/news/2021/03/02/news-release-dhs-st-awards-funding-design-video-analytics-tsa-checkpoints,"March 2, 2021",Press Releases
Looking Back on 18 Years,https://www.dhs.gov/science-and-technology/news/2021/03/01/looking-back-18-years,"March 1, 2021",Blog
News Release: DHS Publishes Free Resources to Protect Critical Infrastructure From GPS Spoofing,https://www.dhs.gov/science-and-technology/news/2021/02/26/news-release-dhs-publishes-free-resources-protect-critical-infrastructure-gps,"February 26, 2021",Press Releases
News Release: S&T Awards Minority Serving Institutions for Summer Research Projects,https://www.dhs.gov/science-and-technology/news/2021/02/24/news-release-st-awards-minority-serving-institutions-summer-research-projects,"February 24, 2021",Press Releases
Consumer Alert: COVID-19 Financial Relief and Protections Extended,https://www.dhs.gov/employee-resources/news/2021/02/23/consumer-alert-covid-19-financial-relief-and-protections-extended,"February 23, 2021",Blog
News Release: S&T Releases New Information Resource to Address African Swine Fever Proactively,https://www.dhs.gov/science-and-technology/news/2021/02/22/news-release-st-releases-new-information-resource-address-african-swine-fever,"February 22, 2021",Press Releases
News Release: DHS Announces R&D Awards to Help Secure Mobile Network Infrastructure,https://www.dhs.gov/science-and-technology/news/2021/02/22/news-release-dhs-announces-rd-awards-help-secure-mobile-network-infrastructure,"February 22, 2021",Press Releases
News Release: S&T Awards Start-up Funding for Self-Screening TSA Checkpoints,https://www.dhs.gov/science-and-technology/news/2021/02/19/news-release-st-awards-start-funding-self-screening-tsa-checkpoints,"February 19, 2021",Press Releases
February 20 is National Love Your Pet Day,https://www.dhs.gov/employee-resources/news/2021/02/18/february-20-national-love-your-pet-day,"February 18, 2021",Blog
News Release: DHS Trains California Fire Services on Situational Awareness Application,https://www.dhs.gov/science-and-technology/news/2021/02/17/news-release-dhs-trains-california-fire-services-situational-awareness-application,"February 17, 2021",Press Releases
Feature Article: NYC Initiatives for Safeguarding the Nation’s Public Transit Systems,https://www.dhs.gov/science-and-technology/news/2021/02/16/feature-article-nyc-initiatives-safeguarding-nations-public-transit-systems,"February 16, 2021",Press Releases
Valentine’s Day Reminder: Review and Update Your Beneficiary Forms,https://www.dhs.gov/employee-resources/news/2021/02/12/valentines-day-reminder-review-and-update-your-beneficiary-forms,"February 12, 2021",Blog
High Blood Pressure,https://www.dhs.gov/employee-resources/news/2021/02/12/high-blood-pressure,"February 12, 2021",Blog
Celebrating the Scientific Contributions of Women and Girls,https://www.dhs.gov/science-and-technology/news/2021/02/11/celebrating-scientific-contributions-women-and-girls,"February 11, 2021",Blog
Heart Health for Seniors,https://www.dhs.gov/employee-resources/news/2021/02/09/heart-health-seniors,"February 9, 2021",Blog
News Release: S&T Awards to Develop Security and Privacy Testing of COVID-19 Contact Tracing Apps,https://www.dhs.gov/science-and-technology/news/2021/02/08/news-release-st-awards-develop-security-and-privacy-testing-covid-19-contact,"February 8, 2021",Press Releases
Feature Article: Air Domain Awareness at the Northern Border,https://www.dhs.gov/science-and-technology/news/2021/02/04/feature-article-air-domain-awareness-northern-border,"February 4, 2021",Press Releases
Family Relationships,https://www.dhs.gov/employee-resources/news/2021/02/04/family-relationships,"February 4, 2021",Blog
CHCO Blog - Light the Fire Within You,https://www.dhs.gov/employee-resources/news/2021/02/03/chco-blog-light-fire-within-you,"February 3, 2021",Blog
News Release: DHS Seeks to Improve Communication Between Public Safety Agencies,https://www.dhs.gov/science-and-technology/news/2021/02/02/news-release-dhs-seeks-improve-communication-between-public-safety-agencies,"February 2, 2021",Press Releases
American Heart Month,https://www.dhs.gov/employee-resources/news/2021/02/02/american-heart-month,"February 2, 2021",Blog
Feature Article: We Do the Science—Securing the Homeland,https://www.dhs.gov/science-and-technology/news/2021/01/28/feature-article-we-do-science-securing-homeland,"January 28, 2021",Press Releases
Legal Resource Benefit Through Your Employee Assistance Program,https://www.dhs.gov/employee-resources/news/2021/01/28/legal-resource-benefit-through-your-employee-assistance-program,"January 28, 2021",Blog
The Importance of Having a Will,https://www.dhs.gov/employee-resources/news/2021/01/25/importance-having-will,"January 25, 2021",Blog
Introducing S&T’s 2021 Strategic Plan,https://www.dhs.gov/science-and-technology/news/2021/01/25/introducing-sts-2021-strategic-plan,"January 25, 2021",Blog
News Release: S&T Announces $36.5M Funding Opportunity for New COE,https://www.dhs.gov/science-and-technology/news/2021/01/25/news-release-st-announces-365m-funding-opportunity-new-coe,"January 25, 2021",Press Releases
Preventing Identity Theft,https://www.dhs.gov/employee-resources/news/2021/01/21/preventing-identity-theft,"January 21, 2021",Blog
Emotional Eating,https://www.dhs.gov/employee-resources/news/2021/01/19/emotional-eating,"January 19, 2021",Blog
News Release: DHS Awards for First Responder Emergency Alerts Technology Development,https://www.dhs.gov/science-and-technology/news/2021/01/19/news-release-dhs-awards-first-responder-emergency-alerts-technology-development,"January 19, 2021",Press Releases
DHS Launches “Be Your REAL ID Self” Public Awareness Campaign,https://www.dhs.gov/real-id/news/2021/01/15/dhs-launches-be-your-real-id-self-public-awareness-campaign,"January 15, 2021",Press Releases
"A Message from Acting Secretary Pete Gaynor on the Observance of Martin Luther King, Jr. Day",https://www.dhs.gov/employee-resources/news/2021/01/15/message-acting-secretary-pete-gaynor-observance-martin-luther-king-jr-day,"January 15, 2021",Blog
Building Resilience,https://www.dhs.gov/employee-resources/news/2021/01/14/building-resilience,"January 14, 2021",Blog
Feature Article: S&T Joins Coalition Seeking to ‘Flush’ out COVID-19 in Wastewater,https://www.dhs.gov/science-and-technology/news/2021/01/14/feature-article-st-joins-coalition-seeking-flush-out-covid-19-wastewater,"January 14, 2021",Press Releases
Financial Resolutions,https://www.dhs.gov/employee-resources/news/2021/01/12/financial-resolutions,"January 12, 2021",Blog
Following the Science: Securing the Nation’s Reopening and Recovery,https://www.dhs.gov/science-and-technology/news/2021/01/11/following-science-securing-nations-reopening-and-recovery,"January 11, 2021",Blog
FPS 50th Anniversary Director's Video Message,https://www.dhs.gov/employee-resources/news/2021/01/11/fps-50th-anniversary-directors-video-message,"January 11, 2021",Blog
News Release: Field Tests Demonstrate Precision of Groundbreaking Firefighter Tracking Technology,https://www.dhs.gov/science-and-technology/news/2021/01/08/news-release-field-tests-demonstrate-precision-groundbreaking-firefighter-tracking,"January 8, 2021",Press Releases
News Release: S&T Seeks Industry Participation in Battle Against Opioids,https://www.dhs.gov/science-and-technology/news/2021/01/08/news-release-st-seeks-industry-participation-battle-against-opioids,"January 8, 2021",Press Releases
Tips to Stay Active for the New Year,https://www.dhs.gov/employee-resources/news/2021/01/07/tips-stay-active-new-year,"January 7, 2021",Blog
New Year’s Resolutions,https://www.dhs.gov/employee-resources/news/2021/01/05/new-years-resolutions,"January 5, 2021",Blog
"CHCO’s Blog – New Year, New Chapter",https://www.dhs.gov/employee-resources/news/2021/01/05/chcos-blog-new-year-new-chapter,"January 5, 2021",Blog
Celebrating the Pursuit of Knowledge in the New Year,https://www.dhs.gov/science-and-technology/news/2021/01/04/celebrating-pursuit-knowledge-new-year,"January 4, 2021",Blog
Winter Safety Tips,https://www.dhs.gov/employee-resources/news/2020/12/22/winter-safety-tips,"December 22, 2020",Blog
Staying Connected During the Holidays,https://www.dhs.gov/employee-resources/news/2020/12/17/staying-connected-during-holidays,"December 17, 2020",Blog
Serving Your Community,https://www.dhs.gov/employee-resources/news/2020/12/10/serving-your-community,"December 10, 2020",Blog
Family Fitness During the Holidays,https://www.dhs.gov/employee-resources/news/2020/12/08/family-fitness-during-holidays,"December 8, 2020",Blog
Flu Signs and Symptoms,https://www.dhs.gov/employee-resources/news/2020/12/07/flu-signs-and-symptoms,"December 7, 2020",Blog
CHCO's Blog - Create Your Own Destiny,https://www.dhs.gov/employee-resources/news/2020/12/03/chcos-blog-create-your-own-destiny,"December 3, 2020",Blog
